aw_deep_link,product_name,aw_product_id,merchant_product_id,merchant_image_url,description,merchant_category,search_price,merchant_name,merchant_id,category_name,category_id,aw_image_url,currency,store_price,delivery_cost,merchant_deep_link,language,last_updated,display_price,data_feed_id,brand_name,in_stock,large_image,alternate_image,alternate_image_two,alternate_image_four,alternate_image_three,gender_added,category_added
https://www.awin1.com/pclick.php?p=44290272069&a=2771700&m=120726,Hot-Selling Top Casual Versatile Solid Color Batwing Sleeve Summer Wave Pattern Top,44290272069,131180999,https://cdn.shopify.com/s/files/1/0885/0073/2222/files/Hot-Selling-Top-Casual-Versatile-Solid-Color-Batwing-Sleeve-Summer-Wave-Pattern-Top-Seldom-Seen-Styles-42906419724606.jpg?v=1750391058,"   Introducing our Hot-Selling Versatile Top, perfect for summer! Made with a solid color design and stylish batwing sleeves, it's the ultimate must-have for any wardrobe. The casual yet chic wave pattern adds a touch of fun to any outfit. Stay cool and stylish this summer season with our top.       ",,21.52,Seldom Seen Styles,120726,,,https://images2.productserve.com/?w=200&h=200&bg=white&trim=5&t=letterbox&url=ssl%3Acdn.shopify.com%2Fs%2Ffiles%2F1%2F0885%2F0073%2F2222%2Ffiles%2FHot-Selling-Top-Casual-Versatile-Solid-Color-Batwing-Sleeve-Summer-Wave-Pattern-Top-Seldom-Seen-Styles-42906419724606.jpg%3Fv%3D1750391058&feedId=111395&k=5acd5c7d57d3b2d5c06ab7f589f2e2f354dace02,USD,,,https://21c525-b8.myshopify.com/products/hot-selling-top-casual-versatile-solid-color-batwing-sleeve-summer-wave-pattern-top?variant=11909168890174,,,USD21.52,111395,Seldom Seen Styles,1,,,,,,Womens,Tops & T-Shirts
https://www.awin1.com/pclick.php?p=44290268147&a=2771700&m=120726,Floral Tops for Women Patchwork Long Sleeve Ribbed Blouses Crewneck Striped Crochet Print Shirts Lace Knit Sweaters,44290268147,131181027,https://cdn.shopify.com/s/files/1/0885/0073/2222/files/Floral-Tops-for-Women-Patchwork-Long-Sleeve-Ribbed-Blouses-Crewneck-Striped-Crochet-Print-Shirts-Lace-Knit-Sweaters-Seldom-Seen-Styles-42906434601278.jpg?v=1750391029,"Elevate your wardrobe with our Floral Patchwork Long Sleeve Top. This Ribbed Blouse features a classic Crewneck design, accented with Striped Crochet Print and delicate Lace Knit detailing. Combining comfort and style, this top is perfect for any occasion, providing a sophisticated touch to any outfit.      ",,24.16,Seldom Seen Styles,120726,,,https://images2.productserve.com/?w=200&h=200&bg=white&trim=5&t=letterbox&url=ssl%3Acdn.shopify.com%2Fs%2Ffiles%2F1%2F0885%2F0073%2F2222%2Ffiles%2FFloral-Tops-for-Women-Patchwork-Long-Sleeve-Ribbed-Blouses-Crewneck-Striped-Crochet-Print-Shirts-Lace-Knit-Sweaters-Seldom-Seen-Styles-42906434601278.jpg%3Fv%3D1750391029&feedId=111395&k=76bc4f89ab41553e1d06f381299db2e0a37ffe0c,USD,,,https://21c525-b8.myshopify.com/products/floral-tops-for-women-patchwork-long-sleeve-ribbed-blouses-crewneck-striped-crochet-print-shirts-lace-knit-sweaters?variant=11909169774910,,,USD24.16,111395,Seldom Seen Styles,1,,,,,,Womens,Jumpers & Knits
https://www.awin1.com/pclick.php?p=44290269351&a=2771700&m=120726,Women's Draped Button Front T Shirts Split Hem Short Sleeve Summer Tee Tops,44290269351,131181055,https://cdn.shopify.com/s/files/1/0885/0073/2222/files/Women-s-Draped-Button-Front-T-Shirts-Split-Hem-Short-Sleeve-Summer-Tee-Tops-Seldom-Seen-Styles-42906441941310.jpg?v=1750390995,"Stay cool and stylish in our Women's Draped Button Front T Shirts. Made with a split hem and short sleeves, our summer tee tops are perfect for warm weather. The draped front and button details elevate the look while keeping you comfortable. Perfect for casual or dressy occasions.  ",,23.33,Seldom Seen Styles,120726,,,https://images2.productserve.com/?w=200&h=200&bg=white&trim=5&t=letterbox&url=ssl%3Acdn.shopify.com%2Fs%2Ffiles%2F1%2F0885%2F0073%2F2222%2Ffiles%2FWomen-s-Draped-Button-Front-T-Shirts-Split-Hem-Short-Sleeve-Summer-Tee-Tops-Seldom-Seen-Styles-42906441941310.jpg%3Fv%3D1750390995&feedId=111395&k=3f4461e631b5c2174b76ea9f18db0486084a4510,USD,,,https://21c525-b8.myshopify.com/products/womens-draped-button-front-t-shirts-split-hem-short-sleeve-summer-tee-tops?variant=11909170331966,,,USD23.33,111395,Seldom Seen Styles,1,,,,,,Womens,Tops & T-Shirts
https://www.awin1.com/pclick.php?p=44290268273&a=2771700&m=120726,Women's Tank Tops Hollow Out Lace Boho Blouse Eyelet Embroidery Sleeveless Tops Shirts,44290268273,131181059,https://cdn.shopify.com/s/files/1/0885/0073/2222/files/Women-s-Tank-Tops-Hollow-Out-Lace-Boho-Blouse-Eyelet-Embroidery-Sleeveless-Tops-Shirts-Seldom-Seen-Styles-42906447249726.jpg?v=1750390976,"Stay stylish and cool this summer with our Women's Tank Tops. Featuring a delicate hollow lace design, intricate eyelet embroidery and a breezy sleeveless cut, these tops are perfect for any boho-inspired look. Elevate your wardrobe with our stunning and comfortable line of blouses.    ",,23.19,Seldom Seen Styles,120726,,,https://images2.productserve.com/?w=200&h=200&bg=white&trim=5&t=letterbox&url=ssl%3Acdn.shopify.com%2Fs%2Ffiles%2F1%2F0885%2F0073%2F2222%2Ffiles%2FWomen-s-Tank-Tops-Hollow-Out-Lace-Boho-Blouse-Eyelet-Embroidery-Sleeveless-Tops-Shirts-Seldom-Seen-Styles-42906447249726.jpg%3Fv%3D1750390976&feedId=111395&k=dbfc542d387286a0caa992a4544ecefb4ae7f66e,USD,,,https://21c525-b8.myshopify.com/products/womens-tank-tops-hollow-out-lace-boho-blouse-eyelet-embroidery-sleeveless-tops-shirts?variant=11909170659646,,,USD23.19,111395,Seldom Seen Styles,1,,,,,,Womens,Tops & T-Shirts
https://www.awin1.com/pclick.php?p=44290269347&a=2771700&m=120726,Women's Striped Print Long Sleeve Round Neck Tee Top Colorblock Soft Knit T Shirt,44290269347,131181115,https://cdn.shopify.com/s/files/1/0885/0073/2222/files/Women-s-Striped-Print-Long-Sleeve-Round-Neck-Tee-Top-Colorblock-Soft-Knit-T-Shirt-Seldom-Seen-Styles-42906455671102.jpg?v=1750390951,"   Upgrade your wardrobe with our Women's Striped Print Long Sleeve Round Neck Tee Top. Featuring a colorblock design and soft knit fabric, this top is perfect for everyday wear. The round neck and long sleeves add a touch of style, making it a versatile addition to your closet.   ",,24.72,Seldom Seen Styles,120726,,,https://images2.productserve.com/?w=200&h=200&bg=white&trim=5&t=letterbox&url=ssl%3Acdn.shopify.com%2Fs%2Ffiles%2F1%2F0885%2F0073%2F2222%2Ffiles%2FWomen-s-Striped-Print-Long-Sleeve-Round-Neck-Tee-Top-Colorblock-Soft-Knit-T-Shirt-Seldom-Seen-Styles-42906455671102.jpg%3Fv%3D1750390951&feedId=111395&k=44fee0b6415499df1e99bc682cd954edb29e7d86,USD,,,https://21c525-b8.myshopify.com/products/womens-striped-print-long-sleeve-round-neck-tee-top-colorblock-soft-knit-t-shirt?variant=11909171151166,,,USD24.72,111395,Seldom Seen Styles,1,,,,,,Womens,Jumpers & Knits
https://www.awin1.com/pclick.php?p=44290269563&a=2771700&m=120726,Bell Sleeve Tie Back Women's Tie Backless Lightweight Sweater Y2k Bell Sleeve Oversized Knit Sweater Top,44290269563,131191893,https://cdn.shopify.com/s/files/1/0885/0073/2222/files/Bell-Sleeve-Tie-Back-Women-s-Tie-Backless-Lightweight-Sweater-Y2k-Bell-Sleeve-Oversized-Knit-Sweater-Top-Seldom-Seen-Styles-43240065892670.jpg?v=1752748270,"• Fit: Regular• Length: Regular• Neckline: Round Neck• Sleeve Type: Flare sleeve• Composition: Acrylic• Details: Backless• Design: Pullover  Fabric has slight stretch Features: Flare sleeve, long sleeve, tie back, boat neck, knitted, loose fit sweater for women Occasion: Ideal option for casual wear, daily wear, going out, weekends, gathering, shopping, etc. Match: This sweater goes well with jeans, pants, skirts, leggings and so on for a chic look Please refer to the Product Measurement in the last image (The Product Measurement is clothes size, NOT human body size)     /* 使容器支持横向滚动 */     .table-container {       overflow-x: auto;       -webkit-overflow-scrolling: touch;       margin: 8px 0;     }      table {       border-collapse: collapse;     }      table, th, td {       border: 1px solid #000;     }      th, td {       padding: 5px;       text-align: center;       font-size: 15px;       white-space: nowrap; /* 确保 th 内容不换行 */     }      th {       background-color: #f2f2f2;       font-size: 13.5px;       white-space: nowrap; /* 确保 th 内容不换行 */     }      Size Length Bust Sleeve Shoulder   Inch CM Inch CM Inch CM Inch CM     S 20.87” 53 32.28” 82 24.41” 62 16.54” 42   M 21.26” 54 33.86” 86 24.80” 63 16.93” 43   L 21.65” 55 35.43” 90 25.20” 64 17.32” 44    The size may have 1-3cm differences due to manual measurement. ",,36.98,Seldom Seen Styles,120726,,,https://images2.productserve.com/?w=200&h=200&bg=white&trim=5&t=letterbox&url=ssl%3Acdn.shopify.com%2Fs%2Ffiles%2F1%2F0885%2F0073%2F2222%2Ffiles%2FBell-Sleeve-Tie-Back-Women-s-Tie-Backless-Lightweight-Sweater-Y2k-Bell-Sleeve-Oversized-Knit-Sweater-Top-Seldom-Seen-Styles-43240065892670.jpg%3Fv%3D1752748270&feedId=111395&k=8d62f7493e2b1660142012fc22e569f22bcefdfc,USD,,,https://21c525-b8.myshopify.com/products/bell-sleeve-tie-back-knit-sweater?variant=11959375921470,,,USD36.98,111395,Seldom Seen Styles,1,,,,,,Womens,Jumpers & Knits
https://www.awin1.com/pclick.php?p=44290269564&a=2771700&m=120726,Loose Fit Crew Neck Knit Sweater Women 2025 Fashion Crewneck Long Sleeve Pullover  Knit Tops Fall Trendy Clothes,44290269564,131191896,https://cdn.shopify.com/s/files/1/0885/0073/2222/files/Loose-Fit-Crew-Neck-Knit-Sweater-Women-2025-Fashion-Crewneck-Long-Sleeve-Pullover-Knit-Tops-Fall-Trendy-Clothes-Seldom-Seen-Styles-43240066384190.jpg?v=1752748257,"• Fit: Loose • Length: Regular • Neckline: Round Neck • Sleeve Type: Regular sleeve • Composition: 30% Acrylic, 70% Polyester • Details: Bright Color • Design: Pullover   /* 使容器支持横向滚动 */     .table-container {       overflow-x: auto;       -webkit-overflow-scrolling: touch;       margin: 8px 0;     }      table {       border-collapse: collapse;     }      table, th, td {       border: 1px solid #000;     }      th, td {       padding: 5px;       text-align: center;       font-size: 15px;       white-space: nowrap; /* 确保 th 内容不换行 */     }      th {       font-size: 13.5px;       white-space: nowrap; /* 确保 th 内容不换行 */     }    	 		 			Size 			Bust 			Sleeve 			Length 		 		 			Inch 			CM 			Inch 			CM 			Inch 			CM 		 	 	 		 			S 			43.70” 			111 			17.32” 			44 			23.23” 			59 		 		 			M 			44.88” 			114 			17.32” 			44 			23.62” 			60 		 		 			L 			46.06” 			117 			17.72” 			45 			24.02” 			61 		 		 			XL 			47.24” 			120 			17.72” 			45 			24.41” 			62 		 	  The size may have 1-3cm differences due to manual measurement.  ",,37.98,Seldom Seen Styles,120726,,,https://images2.productserve.com/?w=200&h=200&bg=white&trim=5&t=letterbox&url=ssl%3Acdn.shopify.com%2Fs%2Ffiles%2F1%2F0885%2F0073%2F2222%2Ffiles%2FLoose-Fit-Crew-Neck-Knit-Sweater-Women-2025-Fashion-Crewneck-Long-Sleeve-Pullover-Knit-Tops-Fall-Trendy-Clothes-Seldom-Seen-Styles-43240066384190.jpg%3Fv%3D1752748257&feedId=111395&k=6df91ee179de5e354990caa53016adb184624e90,USD,,,https://21c525-b8.myshopify.com/products/loose-fit-crew-neck-knit-sweater-1?variant=11959376118078,,,USD37.98,111395,Seldom Seen Styles,1,,,,,,Womens,Jumpers & Knits
https://www.awin1.com/pclick.php?p=44290271327&a=2771700&m=120726,Heart Print Loose Fit Cropped Women Crop Sexy Heart Pullover Knit Sexy Fashion Sweater Long Sleeve Sweatshirt Fall Winter Jumper Top,44290271327,131192776,https://cdn.shopify.com/s/files/1/0885/0073/2222/files/Heart-Print-Loose-Fit-Cropped-Women-Crop-Sexy-Heart-Pullover-Knit-Sexy-Fashion-Sweater-Long-Sleeve-Sweatshirt-Fall-Winter-Jumper-Top-Seldom-Seen-Styles-43240067105086.jpg?v=1752748243,"• Fit: Loose• Length: Regular• Neckline: Round Neck• Sleeve Type: Regular sleeve• Composition: Acrylic• Details: Heart Pattern• Design: Pullover  Fashion Trendy: This women crop sweatshirt clothing is available by long sleeve, knitted, fall winter style, casual, fashion, trendy, heart printed, Y2K 90S style, E-girl style. Suitable for Many Occasions : This women fall sweater sweater top clothes is suitable for casual wear, Valentine's Day, go to vocation, work, office, streetwear, going out, wedding guest wear, daily wear. Cute Colors : This cropped loose fit pullover top is available by Navy Blue, White, Red, Khaki. Size: This women fall winter fashion trendy knitted jumper clothing is available by S, M, L, XL Easy to Match : This round neck crop knit pullover sweater is easy to match with jeans, shorts, trousers or etc, you could find your best match    /* 使容器支持横向滚动 */     .table-container {       overflow-x: auto;       -webkit-overflow-scrolling: touch;       margin: 8px 0;     }      table {       border-collapse: collapse;     }      table, th, td {       border: 1px solid #000;     }      th, td {       padding: 5px;       text-align: center;       font-size: 15px;       white-space: nowrap; /* 确保 th 内容不换行 */     }      th {       background-color: #f2f2f2;       font-size: 13.5px;       white-space: nowrap; /* 确保 th 内容不换行 */     }      Size Bust Sleeve Length After Length   Inch CM Inch CM Inch CM Inch CM     S 55.11” 140 17.71” 45 18.11” 46 20.86” 53   M 57.08” 145 18.11” 46 18.70” 47.5 21.45” 54.5   L 59.44” 151 18.50” 47 19.48” 49.5 22.24” 56.5   XL 61.81” 157 18.89” 48 20.27” 51.5 23.03” 58.5    The size may have 1-3cm differences due to manual measurement. ",,45.98,Seldom Seen Styles,120726,,,https://images2.productserve.com/?w=200&h=200&bg=white&trim=5&t=letterbox&url=ssl%3Acdn.shopify.com%2Fs%2Ffiles%2F1%2F0885%2F0073%2F2222%2Ffiles%2FHeart-Print-Loose-Fit-Cropped-Women-Crop-Sexy-Heart-Pullover-Knit-Sexy-Fashion-Sweater-Long-Sleeve-Sweatshirt-Fall-Winter-Jumper-Top-Seldom-Seen-Styles-43240067105086.jpg%3Fv%3D1752748243&feedId=111395&k=65435a22210d140e2b721d1ba8581463fe488847,USD,,,https://21c525-b8.myshopify.com/products/heart-print-loose-fit-cropped-knit-sweater?variant=11959376478526,,,USD45.98,111395,Seldom Seen Styles,1,,,,,,Womens,Jumpers & Knits
https://www.awin1.com/pclick.php?p=44290269627&a=2771700&m=120726,Fitted Textured Pleated Cotton Linen Women's Casual Long Sleeve Tops Crew Neck Round Hem  T-Shirts Tunic Tops,44290269627,131192780,https://cdn.shopify.com/s/files/1/0885/0073/2222/files/Fitted-Textured-Pleated-Cotton-Linen-Women-s-Casual-Long-Sleeve-Tops-Crew-Neck-Round-Hem-T-Shirts-Tunic-Tops-Seldom-Seen-Styles-43240067268926.jpg?v=1752748243,"• Fit: Slim • Length: Regular • Neckline: U-Neck • Sleeve Type: Regular sleeve • Composition: 55% Linen, 45% Cotton • Details: Pleated • Design: Basic   /* 使容器支持横向滚动 */     .table-container {       overflow-x: auto;       -webkit-overflow-scrolling: touch;       margin: 8px 0;     }      table {       border-collapse: collapse;     }      table, th, td {       border: 1px solid #000;     }      th, td {       padding: 5px;       text-align: center;       font-size: 15px;       white-space: nowrap; /* 确保 th 内容不换行 */     }      th {       background-color: #f2f2f2;       font-size: 13.5px;       white-space: nowrap; /* 确保 th 内容不换行 */     }    	 		 			Size 			Shoulder 			Bust 			Waist 			Sleeve 			Length 		 		 			Inch 			CM 			Inch 			CM 			Inch 			CM 			Inch 			CM 			Inch 			CM 		 	 	 		 			S 			16.14” 			41 			31.50” 			80 			29.53” 			75 			27.36” 			69.5 			28.35” 			72 		 		 			M 			16.73” 			42.5 			33.86” 			86 			31.89” 			81 			27.95” 			71 			29.53” 			75 		 	  The size may have 1-3cm differences due to manual measurement.  ",,48.38,Seldom Seen Styles,120726,,,https://images2.productserve.com/?w=200&h=200&bg=white&trim=5&t=letterbox&url=ssl%3Acdn.shopify.com%2Fs%2Ffiles%2F1%2F0885%2F0073%2F2222%2Ffiles%2FFitted-Textured-Pleated-Cotton-Linen-Women-s-Casual-Long-Sleeve-Tops-Crew-Neck-Round-Hem-T-Shirts-Tunic-Tops-Seldom-Seen-Styles-43240067268926.jpg%3Fv%3D1752748243&feedId=111395&k=2d68368a91d8a3e553df9bf0d012c08f335202ed,USD,,,https://21c525-b8.myshopify.com/products/fitted-textured-pleated-cotton-linen-knit-sweater?variant=11959376511294,,,USD48.38,111395,Seldom Seen Styles,1,,,,,,Womens,Tops & T-Shirts
https://www.awin1.com/pclick.php?p=44290269493&a=2771700&m=120726,Cable  Crew Neck Sweater Women's Casual Oversized Sweaters Y2K Chunky Knit Pullover Tops Loose Sleeves Crew Neck Cable Knitted Sweater Tops,44290269493,131192782,https://cdn.shopify.com/s/files/1/0885/0073/2222/files/Cable-Crew-Neck-Sweater-Women-s-Casual-Oversized-Sweaters-Y2K-Chunky-Knit-Pullover-Tops-Loose-Sleeves-Crew-Neck-Cable-Knitted-Sweater-Tops-Seldom-Seen-Styles-43240067498302.jpg?v=1752748229,"• Fit: Loose• Length: Regular• Neckline: Round Neck• Sleeve Type: Lantern Sleeve• Composition: Acrylic• Details: Crochet• Design: Pullover  Material:This women lightweight oversized sweater is made of high-quality material,which is super soft,skin-friendly,and comfy Feature: This y2k chunky knit sweater features a mock neck,long lantern sleeve,solid color,cable knitted,ribbed knit,ribbed hem,loose cuffs and a relaxed fit Occasion:Crew neck pullover sweaters for women can pair with fashion classic Jeans,joggers,leggings,pants,skirts and any shoes Matching:Women's chunky knit sweater great for Christmas,casual,daily,office,school,outdoors,vacation,street,walk,shopping,date,etc.Suitable for spring,autumn and winter Clean:Hand wash recommended with low temperature water,using mild gentle soap,no bleach    /* 使容器支持横向滚动 */     .table-container {       overflow-x: auto;       -webkit-overflow-scrolling: touch;       margin: 8px 0;     }      table {       border-collapse: collapse;     }      table, th, td {       border: 1px solid #000;     }      th, td {       padding: 5px;       text-align: center;       font-size: 15px;       white-space: nowrap; /* 确保 th 内容不换行 */     }      th {       background-color: #f2f2f2;       font-size: 13.5px;       white-space: nowrap; /* 确保 th 内容不换行 */     }      Size Length Bust Shoulder Sleeve Length   Inch CM Inch CM Inch CM Inch CM     S 24.43” 62 47.28” 120 17.73” 45 22.46” 57   M 24.82” 63 48.86” 124 18.12” 46 22.85” 58   L 25.22” 64 50.43” 128 18.52” 47 23.25” 59    The size may have 1-3cm differences due to manual measurement. ",,43.65,Seldom Seen Styles,120726,,,https://images2.productserve.com/?w=200&h=200&bg=white&trim=5&t=letterbox&url=ssl%3Acdn.shopify.com%2Fs%2Ffiles%2F1%2F0885%2F0073%2F2222%2Ffiles%2FCable-Crew-Neck-Sweater-Women-s-Casual-Oversized-Sweaters-Y2K-Chunky-Knit-Pullover-Tops-Loose-Sleeves-Crew-Neck-Cable-Knitted-Sweater-Tops-Seldom-Seen-Styles-43240067498302.jpg%3Fv%3D1752748229&feedId=111395&k=5fafbbff2d245a3389bb47119b7edf9492700bf8,USD,,,https://21c525-b8.myshopify.com/products/oversized-cable-knit-crew-neck-sweater?variant=11959376544062,,,USD43.65,111395,Seldom Seen Styles,1,,,,,,Womens,Jumpers & Knits
https://www.awin1.com/pclick.php?p=44290269648&a=2771700&m=120726,Plus Size Leopard  Women's Graphic Knit Cardigan Sweater Button Down Long Sleeve Fuzzy Outerwear Top Fall Clothes,44290269648,131192867,https://cdn.shopify.com/s/files/1/0885/0073/2222/files/Plus-Size-Leopard-Women-s-Graphic-Knit-Cardigan-Sweater-Button-Down-Long-Sleeve-Fuzzy-Outerwear-Top-Fall-Clothes-Seldom-Seen-Styles-43240074019134.jpg?v=1752748120,"  • Fit: Loose• Neckline: V-Neck• Sleeve Type: Regular sleeve• Composition: Cotton, Acrylic• Details: Colorblock Design  Fabric: Soft and skin friendly, fabric has medium stretch, and comfortable to wear Features: Cardigan sweaters for women, v neck, drop shoulder, button up, long sleeve, adding a stylish touch to your outfits Match: You can wear it with flare leggings, wide leg jeans, skirts, boots, casual shoes, shoulder bag for a simple but stylish look Good choice for casual daily, hanging out, city walk, weekends, trip, vacation, dating and other occasions Please kindly check the SIZE CHART in Product Description below before ordering       Size Bust Waist Hip   Inch CM Inch CM Inch CM     S 33-35” 84-89 26-27” 66-69 33-35” 84-89   M 36-38” 92-97 28-29” 71-74 36-38” 92-97   L 40-42” 102-107 30-31” 76-79 40-42” 102-107   XL 43-45” 109-114 32-34” 81-86 43-45” 109-114    The size may have 1-3cm differences due to manual measurement.",,47.45,Seldom Seen Styles,120726,,,https://images2.productserve.com/?w=200&h=200&bg=white&trim=5&t=letterbox&url=ssl%3Acdn.shopify.com%2Fs%2Ffiles%2F1%2F0885%2F0073%2F2222%2Ffiles%2FPlus-Size-Leopard-Women-s-Graphic-Knit-Cardigan-Sweater-Button-Down-Long-Sleeve-Fuzzy-Outerwear-Top-Fall-Clothes-Seldom-Seen-Styles-43240074019134.jpg%3Fv%3D1752748120&feedId=111395&k=0d59d12c032f874c2ed41c204ed0acbe0e9b20df,USD,,,https://21c525-b8.myshopify.com/products/plus-size-leopard-knit-cardigan?variant=11959377396030,,,USD47.45,111395,Seldom Seen Styles,1,,,,,,Womens,Jumpers & Knits
https://www.awin1.com/pclick.php?p=44290269896&a=2771700&m=120726,Fitted Crew Neck Long Sleeve Shirts for Women Off Shoulder Ribbed Knit Slim Fit Going Out Tops Outfits 2025 Trendy Fashion Clothes,44290269896,131192871,https://cdn.shopify.com/s/files/1/0885/0073/2222/files/Fitted-Crew-Neck-Long-Sleeve-Shirts-for-Women-Off-Shoulder-Ribbed-Knit-Slim-Fit-Going-Out-Tops-Outfits-2025-Trendy-Fashion-Clothes-Seldom-Seen-Styles-43240074248510.jpg?v=1752748120,"• Fit: Slim• Length: Regular• Neckline: Off-The-Shoulder• Sleeve Type: Regular Sleeve• Composition: 30% Polyester, 70% Acrylic• Details: Shoulder Cutout• Design: Pullover  Stay trendy in this off shoulder ribbed knit top, suitable for many occasion. Made with stretch materials, this long sleeve tops offers a slim fit for a chic look. Ideal for women looking for stylish going out tops. Elevate your outfit with this off shoulder top. The ribbed knit design adds texture, while the slim fit silhouette gives a modern twist. Suitable for women who love y2k fashion. Step out in style with this solid color off shoulder top. The lightweight material and slim fit make it a versatile piece for daily wear. Pair with your stylish bottoms for a fashionable look. Garment Care: We recommend hand washing in cold water and hanging to dry.     /* 使容器支持横向滚动 */     .table-container {       overflow-x: auto;       -webkit-overflow-scrolling: touch;       margin: 8px 0;     }      table {       border-collapse: collapse;     }      table, th, td {       border: 1px solid #000;     }      th, td {       padding: 5px;       text-align: center;       font-size: 15px;       white-space: nowrap; /* 确保 th 内容不换行 */     }      th {       background-color: #f2f2f2;        font-size: 13.5px;       white-space: nowrap; /* 确保 th 内容不换行 */     }      Size Length Bust Sleeve Shoulder   Inch CM Inch CM Inch CM Inch CM     S 30.31” 77 26.00” 66 29.92” 76 15.75” 40   M 30.71” 78 27.56” 70 25.20” 64 16.14” 41   L 31.10” 79 29.13” 74 25.59” 65 16.54” 42    The size may have 1-3cm differences due to manual measurement. ",,37.65,Seldom Seen Styles,120726,,,https://images2.productserve.com/?w=200&h=200&bg=white&trim=5&t=letterbox&url=ssl%3Acdn.shopify.com%2Fs%2Ffiles%2F1%2F0885%2F0073%2F2222%2Ffiles%2FFitted-Crew-Neck-Long-Sleeve-Shirts-for-Women-Off-Shoulder-Ribbed-Knit-Slim-Fit-Going-Out-Tops-Outfits-2025-Trendy-Fashion-Clothes-Seldom-Seen-Styles-43240074248510.jpg%3Fv%3D1752748120&feedId=111395&k=5bf832df9d839a59065a13227d4ce85917c53cf4,USD,,,https://21c525-b8.myshopify.com/products/off-shoulder-fitted-crew-neck-knit-sweater?variant=11959377559870,,,USD37.65,111395,Seldom Seen Styles,1,,,,,,Womens,Tops & T-Shirts
