aw_deep_link,product_name,aw_product_id,merchant_product_id,merchant_image_url,description,merchant_category,search_price,merchant_name,merchant_id,category_name,category_id,aw_image_url,currency,store_price,delivery_cost,merchant_deep_link,language,last_updated,display_price,data_feed_id,brand_name,in_stock,large_image,alternate_image,alternate_image_two,alternate_image_four,alternate_image_three,gender_added,category_added
https://www.awin1.com/pclick.php?p=43786598841&a=2771700&m=120726,Golden Hour Bikini Top Lemon Lush,43786598841,127232627,https://cdn.shopify.com/s/files/1/0885/0073/2222/files/GOLDENHOURBIKINITOPLEMONLUSHSARONG2.jpg?v=1763432388,"WHITE FOX SWIM  The Golden Hour Bikini Top in Lemon Lush is an essential for sun drenched days. This triangle bikini top is a halter neck style with thin elasticated straps and removable padding. To compliment the top, pair with the Belmont Bottoms Lemon Lush and the Luminous Maxi Skirt Lemon Lush for the perfect poolside look!   CUP SIZE RECOMMENDATION: * Please note this is just a recommendation/guide only",,39.99,Seldom Seen Styles,120726,,,https://images2.productserve.com/?w=200&h=200&bg=white&trim=5&t=letterbox&url=ssl%3Acdn.shopify.com%2Fs%2Ffiles%2F1%2F0885%2F0073%2F2222%2Ffiles%2FGOLDENHOURBIKINITOPLEMONLUSHSARONG2.jpg%3Fv%3D1763432388&feedId=111395&k=09d7538afec21b7e6f97130e54f719aea12422c2,USD,,,https://21c525-b8.myshopify.com/products/golden-hour-bikini-top-lemon-lush?variant=12172383912254,,,USD39.99,111395,Seldom Seen Styles,1,,,,,,Womens,Swimwear
https://www.awin1.com/pclick.php?p=43851664226&a=2771700&m=120726,Two Piece Sets for Women Sexy Sleeveless Top Long High Split Maxi Skirt Beach Summer Vacation Elegant Sets,43851664226,127232911,https://cdn.shopify.com/s/files/1/0885/0073/2222/files/saira-maxi-skirt-white-skirt-babyboo-fashion-1169996083.jpg?v=1763621510,"Elevate your ensemble with the Saira Maxi Skirt in pristine white. Crafted from luxurious slinky jersey, this mid-rise statement piece features an asymmetric ruched panel and elegant thigh-high split. The full, gathered silhouette is adorned with a removable orchid brooch at the hip, offering versatile styling options for discerning tastes.   Colour: White. Floral brooch included. Floral brooch can be easily removed. Slinky jersey fabric. Fully lined. Maxi length. Thigh high split. Mid-rise. Ruched asymmetric panel on skirt. Full skirt, gathered into seam.",,48,Seldom Seen Styles,120726,,,https://images2.productserve.com/?w=200&h=200&bg=white&trim=5&t=letterbox&url=ssl%3Acdn.shopify.com%2Fs%2Ffiles%2F1%2F0885%2F0073%2F2222%2Ffiles%2Fsaira-maxi-skirt-white-skirt-babyboo-fashion-1169996083.jpg%3Fv%3D1763621510&feedId=111395&k=6c95613f557ae663d534b362b5d3a70aa183e5da,USD,,,https://21c525-b8.myshopify.com/products/saira-maxi-skirt-white?variant=12174869659966,,,USD48.00,111395,Seldom Seen Styles,1,,,,,,Womens,Co-Ord
https://www.awin1.com/pclick.php?p=43786584947&a=2771700&m=120726,Sweaters for Women Long Sleeve Knit Jumpers Fall Winter Chunky Soft Warm Trendy Pullover Basic Top,43786584947,127233955,https://cdn.shopify.com/s/files/1/0885/0073/2222/files/1--1-Photoroom.jpg?v=1763952013,"Elevate your cold-weather wardrobe with this versatile women's knit sweater, expertly crafted for comfort and style. Featuring a chunky knit construction, this long-sleeve pullover delivers exceptional warmth without sacrificing breathability, making it an ideal layering piece for autumn and winter months. The soft, quality fabric resists pilling while maintaining its shape through repeated wear. Its timeless design transitions seamlessly from casual weekends to professional settings, offering the understated sophistication that discerning shoppers appreciate. Whether paired with tailored trousers or relaxed denim, this essential jumper provides reliable performance season after season.",,39.99,Seldom Seen Styles,120726,,,https://images2.productserve.com/?w=200&h=200&bg=white&trim=5&t=letterbox&url=ssl%3Acdn.shopify.com%2Fs%2Ffiles%2F1%2F0885%2F0073%2F2222%2Ffiles%2F1--1-Photoroom.jpg%3Fv%3D1763952013&feedId=111395&k=8a0b6f22383bd19dfd2826b55f9ae67eda218035,USD,,,https://21c525-b8.myshopify.com/products/isa?variant=12176280551742,,,USD39.99,111395,Seldom Seen Styles,1,,,,,,Womens,Jumpers & Knits
https://www.awin1.com/pclick.php?p=43786583559&a=2771700&m=120726,"Soft Sweaters for Women, Half Turtleneck Pullover Long Sleeve Sweater, Solid Color Drop Shoulder Loose Knitted Top",43786583559,127233967,https://cdn.shopify.com/s/files/1/0885/0073/2222/files/maria-elegante-en-comfortabele-coltrui-5881153.jpg?v=1763952016,"Elevate your everyday wardrobe with this versatile half turtleneck sweater, crafted from soft, quality knit fabric that delivers comfort without compromise. The relaxed drop-shoulder silhouette creates an effortlessly chic aesthetic, while the loose fit accommodates layering and movement. Long sleeves provide warmth through transitional seasons, and the solid color palette ensures seamless coordination with existing pieces. Perfect for casual outings or refined leisure wear, this pullover combines understated elegance with practical wearability.      ",,36.95,Seldom Seen Styles,120726,,,https://images2.productserve.com/?w=200&h=200&bg=white&trim=5&t=letterbox&url=ssl%3Acdn.shopify.com%2Fs%2Ffiles%2F1%2F0885%2F0073%2F2222%2Ffiles%2Fmaria-elegante-en-comfortabele-coltrui-5881153.jpg%3Fv%3D1763952016&feedId=111395&k=a412c79f2201c7822f9a7afd52b3b6bd269c811c,USD,,,https://21c525-b8.myshopify.com/products/claire?variant=12176280584510,,,USD36.95,111395,Seldom Seen Styles,1,,,,,,Womens,Jumpers & Knits
https://www.awin1.com/pclick.php?p=43786599771&a=2771700&m=120726,Women's Elegant Solid Satin Cowl Neck Blouse Long Sleeves Casual Business Dressy Shirts Office Work Ladies Top,43786599771,127234218,https://cdn.shopify.com/s/files/1/0885/0073/2222/files/6d16d663815b47b898a4ac2fafa0bfa2.jpg?v=1763952042,"Elevate your professional wardrobe with this sophisticated satin cowl neck blouse, designed for the modern woman who values versatility and refinement. The luxurious satin fabric drapes beautifully, creating an elegant silhouette that transitions seamlessly from office meetings to evening occasions. Long sleeves provide polished coverage, while the distinctive cowl neckline adds a touch of contemporary style without compromising workplace appropriateness. Perfect for layering or wearing solo, this timeless piece pairs effortlessly with tailored trousers, skirts, or jeans, making it an indispensable addition to any professional wardrobe. SIZE UNIT:CM",,27,Seldom Seen Styles,120726,,,https://images2.productserve.com/?w=200&h=200&bg=white&trim=5&t=letterbox&url=ssl%3Acdn.shopify.com%2Fs%2Ffiles%2F1%2F0885%2F0073%2F2222%2Ffiles%2F6d16d663815b47b898a4ac2fafa0bfa2.jpg%3Fv%3D1763952042&feedId=111395&k=e4c381164dc86c61187955da902a2c71c0dee10b,USD,,,https://21c525-b8.myshopify.com/products/sylvie-bluzka-s-luxusnym-leskom-a-plisovanym-vystrihom?variant=12176280912190,,,USD27.00,111395,Seldom Seen Styles,1,,,,,,Womens,Blouses
https://www.awin1.com/pclick.php?p=43851664412&a=2771700&m=120726,"Women's casual set, printed top and loose pants",43851664412,127234793,https://cdn.shopify.com/s/files/1/0885/0073/2222/files/DM_20251007182125_001.png?v=1763958752,"Whole Shop! Buy more, Save more!     Minimum Qty  Discount     2+ 5% OFF   3+ 10% OFF              SIZE TABLE                 Size Bust Top length Waist Pants length   CM CM CM CM   S 95 65 67 98   M 100 66.5 72 99.5   L 105 68 77 101   XL 111 69.5 83 102.5   2XL 117 71 89 104   3XL 123 71 95 104   4XL 129 73 101 106   5XL 135 73 107 106          Features Easy-Fit Long Sleeve Shirt – This shirt features a crew neck and warm long sleeves for comfort and freedom of movement. The classic design is perfect for layering or wearing alone year-round. This timeless style remains timeless and appealing.  Adjustable Cropped Pants – These pants feature a drawstring waistband for a customized fit, while the ankle-length length elongates the leg and accentuates the ankle. Designed for all-day comfort, they create a casual, modern look that's easy to style.  Stylish and Practical – This set features a monogram print and a relaxed fit, making it easy to coordinate with any wardrobe. Whether you're on the go or just need a simple, chic piece, you'll always be stylish.  Always Ready – This set is perfect for any occasion, from shopping to a casual coffee date. The minimalist design ensures you're always stylishly ready with ease.  Easy Care, High Performance – This set is washable for easy care. Even with a quick wash, it stays fresh, allowing you to focus on more important things.  SpecificationsColors: White, KhakiSizes: S-5XLMaterial: Cotton and Linen Package ContentsOne women's casual set, including a solid-colored top and pants. NotesDue to manual measurement, please allow 2-3 cm for discrepancies. Please confirm before purchasing. Colors displayed on screen may vary slightly from actual colors.   NOTE  Please follow the size chart strictly to select the size. Do not choose directly according to your habits. The size can have 1-3 cm differences due to manual measurement. Note when you measure. Due to different displays and light effects, the actual color of the item may differ slightly from the color shown in the pictures.",,48,Seldom Seen Styles,120726,,,https://images2.productserve.com/?w=200&h=200&bg=white&trim=5&t=letterbox&url=ssl%3Acdn.shopify.com%2Fs%2Ffiles%2F1%2F0885%2F0073%2F2222%2Ffiles%2FDM_20251007182125_001.png%3Fv%3D1763958752&feedId=111395&k=d2abeba63ffd0f2e807e9eeb598b5fdcd48dee31,USD,,,https://21c525-b8.myshopify.com/products/womens-casual-set-printed-top-and-loose-pants?variant=12176292086078,,,USD48.00,111395,Seldom Seen Styles,1,,,,,,Womens,Co-Ord
https://www.awin1.com/pclick.php?p=43786599740&a=2771700&m=120726,Casual Retro Tiger and Leopard Print Long-sleeved Top,43786599740,127234805,https://cdn.shopify.com/s/files/1/0885/0073/2222/files/O1CN012BBjM41c2HfPOCACa__2208129443542-0-cib.jpg?v=1763958754,"Note: 1. Please allow slight 1-3cm(0.4-1.18') difference due to manual measurement and a little color variation for different display setting 2. Size doesn't fit all, please carefully check size chart and select the size based on your real size 3. If you are not sure, please choose a larger size.(1cm=0.39inch，1cich=2.54cm)       OUR GUARANTEE  ? Insured Worldwide Shipping: Each order includes real-time tracking details and insurance coverage in the unlikely event that a package gets lost or stolen in transit. ? Money-Back Guarantee: If your items arrive damaged or become defective within 15 days of normal usage, we will gladly issue out a replacement or refund. ✉️ 24/7 Customer Support: We have a team of live reps ready to help and answer any questions you have within a 24-hour time frame, 7 days a week. ? Safe & Secure Checkouts: We use state-of-the-art SSL Secure encryption to keep your personal and financial information 100% protected.",,29,Seldom Seen Styles,120726,,,https://images2.productserve.com/?w=200&h=200&bg=white&trim=5&t=letterbox&url=ssl%3Acdn.shopify.com%2Fs%2Ffiles%2F1%2F0885%2F0073%2F2222%2Ffiles%2FO1CN012BBjM41c2HfPOCACa__2208129443542-0-cib.jpg%3Fv%3D1763958754&feedId=111395&k=514ed4f0d737bf0c282fc381023074ad6a88bcc7,USD,,,https://21c525-b8.myshopify.com/products/casual-print-long-sleeved-top?variant=12176292118846,,,USD29.00,111395,Seldom Seen Styles,1,,,,,,Womens,Tops & T-Shirts
https://www.awin1.com/pclick.php?p=43851664700&a=2771700&m=120726,Women's Elegance V-Neck Top & Wide-Leg Pants Set,43851664700,127855212,https://cdn.shopify.com/s/files/1/0885/0073/2222/files/spp_20250529162717_1d14e9b5a640946908c59e5e780f7031_bee69701-c339-4225-a92a-1172f6597fbf.png?v=1765181498,"SIZE GUIDE   FEATURES SINGLE-BUTTON DESIGN - The single center button adds a touch of sophistication while ensuring a secure fit. This feature elevates the set’s elegance, making it perfect for both casual and semi-formal occasions.   ELEGANT V-NECK TOP - The flattering V-neckline frames the collarbone beautifully, creating a refined look. Its timeless design pairs seamlessly with the wide-leg pants for a cohesive, chic ensemble.  WIDE-LEG PANTS - Designed for effortless movement, the wide-leg cut offers a relaxed yet stylish fit. Perfect for those who value comfort without compromising on fashion.  ULTIMATE COMFORT & EFFORTLESS STYLE - The loose fit of both pieces allows for unrestricted movement, making it suitable for various activities. The set’s versatility transitions seamlessly from work to leisure, offering a stylish solution for any occasion.  EASY-CARE FABRIC - Crafted from a breathable polyester blend, this set is effortless to care for and retains its fresh look wash after wash. The durable, wrinkle-resistant material ensures long-lasting wear while saving you time on maintenance.  SPECIFICATIONS Color: Dark Brown, Khaki, Black, Dark Grey  Size: S - 3XL Material: Polyester Package Includes: 1* Women's Elegance V-Neck Top & Wide-Leg Pants Set NOTES Please allow 2-3cm error due to manual measurement. Please make sure you do not mind before purchasing. Color may not appear as exactly as in real life due to variations between the computer monitors.",,41,Seldom Seen Styles,120726,,,https://images2.productserve.com/?w=200&h=200&bg=white&trim=5&t=letterbox&url=ssl%3Acdn.shopify.com%2Fs%2Ffiles%2F1%2F0885%2F0073%2F2222%2Ffiles%2Fspp_20250529162717_1d14e9b5a640946908c59e5e780f7031_bee69701-c339-4225-a92a-1172f6597fbf.png%3Fv%3D1765181498&feedId=111395&k=9486811027d2fb7272d5160950f5f962dfba4cc1,USD,,,https://21c525-b8.myshopify.com/products/elegant-v-ringad-topp-och-vida-byxor-set-for-kvinnor?variant=12199648297278,,,USD41.00,111395,Seldom Seen Styles,1,,,,,,Womens,Co-Ord
https://www.awin1.com/pclick.php?p=43851664747&a=2771700&m=120726,Women's Casual Top & Pants 2-Piece Set,43851664747,127855248,https://cdn.shopify.com/s/files/1/0885/0073/2222/files/spp_20250412172017_7b6d0d026a3e77660993140a7b36f0a7_3462e49a-3a2c-4589-b6c7-fdb3fdf74e55.jpg?v=1765181504,"SIZE CHART   FEATURES COZY & BREATHABLE: Crafted from a carefully curated blend of cotton and linen blend fabrics, this 2-piece set is both comfortable and breathable. The lightweight material ensures all-day ease of wear.  CASUAL & VERSATILE: This 2-piece set offers a casual, sporty aesthetic with a versatile solid color design. The coordinated top and pants can be worn together or mixed and matched with other wardrobe pieces.  FASHION & CLASSIC: The zippered top features a sleek and stylish full-length zipper closure, allowing for easy and convenient wear. The hem of the top is designed with an adjustable drawstring, providing a comfortable and flattering fit, and offering a sleek, polished look. CONVENIENT POCKETS: The relaxed pants include 2 spacious, zippered pockets, offering secure storage for your essentials. These functional pockets also add a modern touch to the design.  INCLUSIVE SIZE RANGE: Available in sizes S-4XL, this sweater coat caters to a wide range of body types, ensuring a flattering and comfortable fit for everyone.  SPEC Pattern: Solid Color Color: White, Black, Blue, Red, Yellow Material: Cotton and Linen Blend Fit: Loose Size: S-4XL Package Includes: 1*Top + 1*Pants NOTES Color may not appear as exactly as in real life due to variations between the computer monitors. Please allow a small error due to manual measurement. Please make sure you do not mind before purchasing.",,45,Seldom Seen Styles,120726,,,https://images2.productserve.com/?w=200&h=200&bg=white&trim=5&t=letterbox&url=ssl%3Acdn.shopify.com%2Fs%2Ffiles%2F1%2F0885%2F0073%2F2222%2Ffiles%2Fspp_20250412172017_7b6d0d026a3e77660993140a7b36f0a7_3462e49a-3a2c-4589-b6c7-fdb3fdf74e55.jpg%3Fv%3D1765181504&feedId=111395&k=e14113156e05a507ad4cdd5c472626174a54268a,USD,,,https://21c525-b8.myshopify.com/products/women-s-casual-top-pants-2-piece-set?variant=12199648362814,,,USD45.00,111395,Seldom Seen Styles,1,,,,,,Womens,Co-Ord
https://www.awin1.com/pclick.php?p=43855688849&a=2771700&m=120726,OCTAVIA TOP - NEUTRAL : CREAM,43855688849,128027898,https://cdn.shopify.com/s/files/1/0885/0073/2222/files/TM16942_OCTAVIA_CREAM_2_06d5797e-3d29-4ca1-a18d-3516fc4b223a.png?v=1765958259,Best-selling Octavia Top in a cream colourway Adjustable spaghetti straps Scoop neckline Adjustable band with hook and eye clasp closure at back bust Floral embellishment at front bodice - Print is created with appliqué diamante detail Fully lined - Bust is jersey lined and the body is mesh lined Colour may vary due to lighting on images. The product images (without model) are closest to the product's true colour,,38,Seldom Seen Styles,120726,,,https://images2.productserve.com/?w=200&h=200&bg=white&trim=5&t=letterbox&url=ssl%3Acdn.shopify.com%2Fs%2Ffiles%2F1%2F0885%2F0073%2F2222%2Ffiles%2FTM16942_OCTAVIA_CREAM_2_06d5797e-3d29-4ca1-a18d-3516fc4b223a.png%3Fv%3D1765958259&feedId=111395&k=6511ce935d88ee9964ff2e5dd9e1b8fbf150f63a,USD,,,https://21c525-b8.myshopify.com/products/octavia-top-neutral-cream?variant=12210946015550,,,USD38.00,111395,Seldom Seen Styles,1,,,,,,Womens,Tops & T-Shirts
https://www.awin1.com/pclick.php?p=44152703969&a=2771700&m=120726,Split Hem Top & Biker Shorts,44152703969,129794795,https://cdn.shopify.com/s/files/1/0885/0073/2222/files/anh-nguoi-mau-ai-1772466099395.jpg?v=1772775746,"Effortless comfort for sunny days.This Summer Two-Piece Set is designed for relaxed, everyday wear while keeping a clean and minimalist look. Featuring an oversized crewneck top with split hem detail and matching biker shorts, this set delivers breathable comfort and casual versatility for home, travel, or weekend outings. Crafted with a soft cotton-spandex blend and medium stretch, it offers a regular fit that feels lightweight and flexible against the skin. The elastic waistband ensures easy wear, while the loose silhouette keeps you cool throughout warm summer days. Perfect for lounging, casual errands, or cozy homewear, this minimalist set balances comfort and simplicity effortlessly. Details:– Classic O-neck crew collar– Oversized loose top with split hem– Above-knee biker shorts– Elastic waistband for comfort– Short sleeves (4–16 inch range)– Solid color minimalist design– Pullover style Material & Care:Made from cotton and spandex with 71%–80% fabric content and medium stretch. Soft, breathable knit fabric ideal for summer. Gentle machine wash recommended. Hang to dry. Style Tip:Pair with sneakers for an easy daytime look or slide sandals for relaxed at-home comfort.",,39.99,Seldom Seen Styles,120726,,,https://images2.productserve.com/?w=200&h=200&bg=white&trim=5&t=letterbox&url=ssl%3Acdn.shopify.com%2Fs%2Ffiles%2F1%2F0885%2F0073%2F2222%2Ffiles%2Fanh-nguoi-mau-ai-1772466099395.jpg%3Fv%3D1772775746&feedId=111395&k=45c75778efc0bc11819b0503d08c05dc59e9260d,USD,,,https://21c525-b8.myshopify.com/products/prettygarden?variant=12287591842110,,,USD39.99,111395,Seldom Seen Styles,1,,,,,,Womens,Co-Ord
https://www.awin1.com/pclick.php?p=44244505228&a=2771700&m=120726,Women's Casual Two Piece Sets Color Block Crewneck Sleeveless Pullover Tops Matching Shorts With Pockets,44244505228,130582320,https://cdn.shopify.com/s/files/1/0885/0073/2222/files/00c501e8-5ab9-48fb-8924-f7805e89e386.jpg?v=1756959341,"This women's two-piece set features a color block design with a sleeveless crewneck pullover top paired with matching shorts equipped with convenient pockets. Crafted for casual comfort, this ensemble balances style and function, making it ideal for relaxed outings or everyday wear. The breathable fabric and practical fit ensure ease of movement while maintaining a polished look.",,27.01,Seldom Seen Styles,120726,,,https://images2.productserve.com/?w=200&h=200&bg=white&trim=5&t=letterbox&url=ssl%3Acdn.shopify.com%2Fs%2Ffiles%2F1%2F0885%2F0073%2F2222%2Ffiles%2F00c501e8-5ab9-48fb-8924-f7805e89e386.jpg%3Fv%3D1756959341&feedId=111395&k=f80fa42c646c06c57e25e33807b38cd3c5def568,USD,,,https://21c525-b8.myshopify.com/products/womens-casual-two-piece-sets-color-block-crewneck-sleeveless-pullover-tops-matching-shorts-with-pockets?variant=12024237031742,,,USD27.01,111395,Seldom Seen Styles,1,,,,,,Womens,Co-Ord
https://www.awin1.com/pclick.php?p=44255470970&a=2771700&m=120726,Long Sleeve Fall Tops Oversized 2025 Trendy Round Crew Neck Casual Color Block Womens Shirts Blouses,44255470970,130582374,https://cdn.shopify.com/s/files/1/0885/0073/2222/files/d1528120-ecd4-49f4-9ad9-556b81ccb747.jpg?v=1756959371,"Embrace the 2025 fall fashion trend with these oversized long sleeve tops designed for comfort and style. Featuring a trendy round crew neck and eye-catching color block patterns, these casual blouses offer a relaxed fit that suits everyday wear. Crafted to blend modern design with cozy functionality, they provide versatility for layering or standalone wear throughout the cooler seasons. Perfect for women seeking a balance of fashion-forward appeal and effortless comfort in their wardrobe. ***    ",,28.13,Seldom Seen Styles,120726,,,https://images2.productserve.com/?w=200&h=200&bg=white&trim=5&t=letterbox&url=ssl%3Acdn.shopify.com%2Fs%2Ffiles%2F1%2F0885%2F0073%2F2222%2Ffiles%2Fd1528120-ecd4-49f4-9ad9-556b81ccb747.jpg%3Fv%3D1756959371&feedId=111395&k=c1cff2c48df8e39b11e78dcbe57dbec95701c06a,USD,,,https://21c525-b8.myshopify.com/products/long-sleeve-fall-tops-oversized-2025-trendy-round-crew-neck-casual-color-block-womens-shirts-blouses?variant=12024237162814,,,USD28.13,111395,Seldom Seen Styles,1,,,,,,Womens,Tops & T-Shirts
https://www.awin1.com/pclick.php?p=44255467631&a=2771700&m=120726,Trendy Women’s Quarter Zip Pullover Hoodie Denim Hooded Shirt – Casual Chic Streetwear Top,44255467631,130582568,https://cdn.shopify.com/s/files/1/0885/0073/2222/files/eb512d71-28c0-4628-8006-502377930770.jpg?v=1756961379,"This Women's Half Zip Denim Hoodie Pullover Jacket combines the classic durability of denim with the casual comfort of a hoodie. Featuring a convenient half-zip front, it allows for adjustable ventilation and ease of wear. Its versatile jean-top style pairs effortlessly with a variety of outfits, making it a practical yet stylish choice for everyday layering. Durable construction ensures long-lasting use, while the pullover design offers a relaxed fit for all-day comfort.",,41,Seldom Seen Styles,120726,,,https://images2.productserve.com/?w=200&h=200&bg=white&trim=5&t=letterbox&url=ssl%3Acdn.shopify.com%2Fs%2Ffiles%2F1%2F0885%2F0073%2F2222%2Ffiles%2Feb512d71-28c0-4628-8006-502377930770.jpg%3Fv%3D1756961379&feedId=111395&k=deb60300b854c256bdc68056ac6935725b72029e,USD,,,https://21c525-b8.myshopify.com/products/trendy-women-s-quarter-zip-pullover-hoodie-denim-hooded-shirt-casual-chic-streetwear-top?variant=12024237982014,,,USD41.00,111395,Seldom Seen Styles,1,,,,,,Womens,Tops & T-Shirts
https://www.awin1.com/pclick.php?p=44244498236&a=2771700&m=120726,Womens Tops Casual Summer Crewneck Short Sleeve Striped Color Block Knit High Low Trendy Pullover Sweaters,44244498236,130582620,https://cdn.shopify.com/s/files/1/0885/0073/2222/files/90b59303-eaaa-4a09-8dbe-37895495de1e.jpg?v=1756959638,"This casual summer top combines comfort and style with its breathable knit fabric and short sleeves. Featuring a trendy crewneck and a striped color block design, it adds a modern touch to any wardrobe. The high-low hem creates a flattering silhouette, making it perfect for everyday wear or relaxed outings. Durable and lightweight, this pullover sweater is ideal for warm weather while maintaining a polished look.",,26.45,Seldom Seen Styles,120726,,,https://images2.productserve.com/?w=200&h=200&bg=white&trim=5&t=letterbox&url=ssl%3Acdn.shopify.com%2Fs%2Ffiles%2F1%2F0885%2F0073%2F2222%2Ffiles%2F90b59303-eaaa-4a09-8dbe-37895495de1e.jpg%3Fv%3D1756959638&feedId=111395&k=bb003669b738b01ddc539af18d120d37798a7062,USD,,,https://21c525-b8.myshopify.com/products/womens-tops-casual-summer-crewneck-short-sleeve-striped-color-block-knit-high-low-trendy-pullover-sweaters?variant=12024238080318,,,USD26.45,111395,Seldom Seen Styles,1,,,,,,Womens,Jumpers & Knits
https://www.awin1.com/pclick.php?p=44255467881&a=2771700&m=120726,Women's Casual Basic V-Neck Ribbed Knitted Shirts Pullover Tunic Tops Loose Balloon Sleeve Blouses Top,44255467881,130582636,https://cdn.shopify.com/s/files/1/0885/0073/2222/files/2ea50f75-dd11-46e2-89d8-8cc8bc6a18dd.jpg?v=1756959684,"comfortable and stylish, making it an ideal choice for casual occasions.Crafted from a super soft fine knit fabric that is skin-friendly and breathable, this top provides an extra cuddle factor that will keep you cozy all day long.The V-neckline adds a touch of elegance to this minimalist yet chic design.",,22,Seldom Seen Styles,120726,,,https://images2.productserve.com/?w=200&h=200&bg=white&trim=5&t=letterbox&url=ssl%3Acdn.shopify.com%2Fs%2Ffiles%2F1%2F0885%2F0073%2F2222%2Ffiles%2F2ea50f75-dd11-46e2-89d8-8cc8bc6a18dd.jpg%3Fv%3D1756959684&feedId=111395&k=130ac599460a0f32efecfe59ced026e408691e20,USD,,,https://21c525-b8.myshopify.com/products/womens-casual-basic-v-neck-ribbed-knitted-shirts-pullover-tunic-tops-loose-balloon-sleeve-blouses-top?variant=12024238178622,,,USD22.00,111395,Seldom Seen Styles,1,,,,,,Womens,Jumpers & Knits
