aw_deep_link,product_name,aw_product_id,merchant_product_id,merchant_image_url,description,merchant_category,search_price,merchant_name,merchant_id,category_name,category_id,aw_image_url,currency,store_price,delivery_cost,merchant_deep_link,language,last_updated,display_price,data_feed_id,brand_name,in_stock,large_image,alternate_image,alternate_image_two,alternate_image_four,alternate_image_three,gender_added,category_added
https://www.awin1.com/pclick.php?p=43674155677&a=2771700&m=120726,Casual Travel Stand Collar Side Zipper Top Straight Pants Two-Piece Set,43674155677,126275112,https://cdn.shopify.com/s/files/1/0885/0073/2222/files/327ce08e2ecd10a665f44501b71e6090_92952bce-6359-4d19-8ffd-47e353717c6f.webp?v=1766746053,"Product Details:   Product ID: Gender: For Women Style: Casual Fit Type:Regular Tops Length: Regular Sleeves Length: Long Sleeve Collar: Stand Collar  Material: Mixed Cotton Material Stretch: HIgh Stretch Pants Details:Elastic waist, side pockets Weight: 0.38kg Package: 1 x Top,1 x Pant Size Guide For Women  More layers, more ease, more comfort. This comfortable and simple turtleneck top is made from soft cotton yarn, combining texture and comfort. It's easy to style and suitable for various occasions. The side zippered hem and slightly longer back allow for easy movement and add a touch of style. Care Tips: 81% Viscose, 15% Polyester, 4% Spandex. Machine wash cold. Do not bleach. Do not tumble dry. Do not dry clean. Iron on low heat. Wash with other garments of the same color. Turn inside out before washing. Remove immediately after washing and lay flat to dry.",,46.99,Seldom Seen Styles,120726,,,https://images2.productserve.com/?w=200&h=200&bg=white&trim=5&t=letterbox&url=ssl%3Acdn.shopify.com%2Fs%2Ffiles%2F1%2F0885%2F0073%2F2222%2Ffiles%2F327ce08e2ecd10a665f44501b71e6090_92952bce-6359-4d19-8ffd-47e353717c6f.webp%3Fv%3D1766746053&feedId=111395&k=35fd2407d43762a5195a2b58365200bbbe84f669,USD,,,https://21c525-b8.myshopify.com/products/casual-travel-stand-collar-side-zipper-top-straight-pants-two-piece-setd935ecd2-24cc-4c13-91a0-ba480eb35ce3?variant=12219333116222,,,USD46.99,111395,Seldom Seen Styles,1,,,,,,Womens,Co-Ord
https://www.awin1.com/pclick.php?p=43662191326&a=2771700&m=120726,NIKI MINI DRESS OPAL TOPAZ,43662191326,126281083,https://cdn.shopify.com/s/files/1/0885/0073/2222/files/NIKI-MINI-DRESS-OPAL-TOPAZ26.jpg?v=1767525311,"Our 'Niki Mini Dress' in Opal Topaz is a vacation essential!  Crafted from printed mesh fabrication, her bodycon silhouette effortlessly flaunts a scoop halter neckline, beautifully adorned with statement pink beads and a silver chain. Featuring keyhole cut-outs on the bust and bodice, she transitions seamlessly into a ruched waistband with a detachable waist chain, adding a playful yet polished touch. Her flouncy skirt enhances movement with every step, while the open back with a clip closure completes the look with a bold, sultry edge. Style with strappy heels and minimal jewellery for your next rooftop soirée or coastal vacation night out!",,19,Seldom Seen Styles,120726,,,https://images2.productserve.com/?w=200&h=200&bg=white&trim=5&t=letterbox&url=ssl%3Acdn.shopify.com%2Fs%2Ffiles%2F1%2F0885%2F0073%2F2222%2Ffiles%2FNIKI-MINI-DRESS-OPAL-TOPAZ26.jpg%3Fv%3D1767525311&feedId=111395&k=55705c770e0199efd7ed034d223cf4237a2ded82,USD,,,https://21c525-b8.myshopify.com/products/niki-mini-dress-opal-topaz?variant=12224739934526,,,USD19.00,111395,Seldom Seen Styles,1,,,,,,Womens,Dresses
https://www.awin1.com/pclick.php?p=43851667174&a=2771700&m=120726,SORELA Crop Top & Lace-up Pants Set,43851667174,126281106,https://cdn.shopify.com/s/files/1/0885/0073/2222/files/replicate-prediction-dnmz1hx65xrj20csnsa84ke3zc.jpg?v=1767525319,"Make a bold entrance in the Solera Set. The micro-bandeau pairs with high-waist pants featuring dramatic lace-up openings from hip to hem. Adjustable ties sculpt your shape, while stretch fabric ensures a sleek, comfortable fit with unapologetic baddie energy.  Two-piece set Strappy bandeau Full-length pants  Lace-up cutouts Adjustable ties  Sizing & Fit Model 1, wearing white is 5'5'', and wearing a size S. (UK 8/US 5) FABRIC & CARE 95% Polyester, 5% Spandex  Maximum washing temperature 30°C/86°F Do not bleach Wash with similar colors Iron at a maximum of 110°C/230°F Do not dry clean",,42.95,Seldom Seen Styles,120726,,,https://images2.productserve.com/?w=200&h=200&bg=white&trim=5&t=letterbox&url=ssl%3Acdn.shopify.com%2Fs%2Ffiles%2F1%2F0885%2F0073%2F2222%2Ffiles%2Freplicate-prediction-dnmz1hx65xrj20csnsa84ke3zc.jpg%3Fv%3D1767525319&feedId=111395&k=05205d95fed8c30dd91590203b2c90f6c6e4a788,USD,,,https://21c525-b8.myshopify.com/products/sorela-crop-top-lace-up-pants-set?variant=12224740065598,,,USD42.95,111395,Seldom Seen Styles,1,,,,,,Womens,Co-Ord
https://www.awin1.com/pclick.php?p=43742696404&a=2771700&m=120726,AUTOMET Women's 3 Pack Long Sleeve Crop Tops Slim Fit Y2K Fashion Basic Layering Shirts,43742696404,126843744,https://cdn.shopify.com/s/files/1/0885/0073/2222/files/6291b55b594a47ed96d9a988525c8584_tplv-fhlh96nyum-resize-jpeg_800_800.jpg?v=1767087883,"Elevate Your Style with AUTOMET Transform your look with the AUTOMET Women's 3 Pack Long Sleeve Crop Tops. These slim fit shirts are ideal for spring, summer, and autumn. Perfect for casual wear, they boast a Korean style design. The pack comes in haze blue, white, and black. These minimalist tops are excellent for layering. Key Features3 Pack: Includes haze blue, white, and black tops.Long Sleeve: Offers extra coverage and style.Slim Fit: Ensures a flattering silhouette.Y2K Fashion: Adds a trendy touch to your wardrobe. Versatile and StylishThese crop tops are versatile for various occasions. Whether you're out or at home, these shirts are a great addition. They are perfect for casual outings and everyday wear.",,34.99,Seldom Seen Styles,120726,,,https://images2.productserve.com/?w=200&h=200&bg=white&trim=5&t=letterbox&url=ssl%3Acdn.shopify.com%2Fs%2Ffiles%2F1%2F0885%2F0073%2F2222%2Ffiles%2F6291b55b594a47ed96d9a988525c8584_tplv-fhlh96nyum-resize-jpeg_800_800.jpg%3Fv%3D1767087883&feedId=111395&k=4006a6e38ab40b4169ec346dd0edc7402cb4a78e,USD,,,https://21c525-b8.myshopify.com/products/automet-womens-3-pack-long-sleeve-crop-tops-slim-fit-y2k-fashion-basic-layering-shirts-haze-blue-white-black-minimalist-casual-korean-style-everyday-womenswear-short-summer?variant=12221470507326,,,USD34.99,111395,Seldom Seen Styles,1,,,,,,Womens,Tops & T-Shirts
https://www.awin1.com/pclick.php?p=43851666874&a=2771700&m=120726,BTFBM 2-Piece Ribbed Knit Long Sleeve Crop Top Wide Leg Pants Matching Lounge Set Loungewear,43851666874,126870141,https://cdn.shopify.com/s/files/1/0885/0073/2222/files/da355cad51444502b6a59a2405defd69_tplv-fhlh96nyum-resize-jpeg_800_800.jpg?v=1767087871,"Fabric Type: 95% Polyester, 5% ElastaneSize Attention: S=US 4-6, M=US 8-10, L=US 12-14, XL=US 16-18, XXL=US 20Design: The slim, cropped top emphasizes curves while the wide-leg pants provide an elegant look that is both chic and casual. Made with elastane and polyester materials, it stretches easily without losing its shape over time.Season: This lounge set can be worn in all seasons for year-round comfort.Fashionable Occasion Wear: This versatile 2-piece suit can be worn on casual occasions to elevate the look while keeping it comfortable at the same time. The crew neck design of the top adds an elegant touch that pairs well with necklaces or other accessories. Available in regular sizes, this slim-fit loungewear outfit provides maximum style without sacrificing comfort.",,39.89,Seldom Seen Styles,120726,,,https://images2.productserve.com/?w=200&h=200&bg=white&trim=5&t=letterbox&url=ssl%3Acdn.shopify.com%2Fs%2Ffiles%2F1%2F0885%2F0073%2F2222%2Ffiles%2Fda355cad51444502b6a59a2405defd69_tplv-fhlh96nyum-resize-jpeg_800_800.jpg%3Fv%3D1767087871&feedId=111395&k=4c961b160725f9a3a80932db59bdfe873ffe7b3c,USD,,,https://21c525-b8.myshopify.com/products/btfbm-2-piece-ribbed-knit-long-sleeve-crop-top-wide-leg-pants-matching-lounge-set-loungewear?variant=12221469851966,,,USD39.89,111395,Seldom Seen Styles,1,,,,,,Womens,Co-Ord
https://www.awin1.com/pclick.php?p=43742696385&a=2771700&m=120726,AUTOMET Women's 3-Piece Long Sleeve Shirts Basic Crop Tops Going Out Fall Fashion Underscrubs Layer Slim,43742696385,126880468,https://cdn.shopify.com/s/files/1/0885/0073/2222/files/637bbea57b3342e5b03cae76ad35437b_tplv-fhlh96nyum-resize-jpeg_800_800.jpg?v=1767086426,"AUTOMET Women's 3-Piece Long Sleeve Shirts Material & Feel  • Made from 88% polyester, 12% spandex, this fabric is lightweight, super soft, and high-stretch. It offers a second-skin feel. The cropped, stretch-fitted style features a crew neck and tight underscrubs design. Wear it regularly or fold it up for a slim fit. Perfect for casual Y2K style fashion.Versatility & OccasionsIdeal for various occasions, this shirt is great for going out, workouts, running, gym, yoga, daily wear, streetwear, rave parties, clubs, dating, beach, travel, vacations, shopping, etc. Suitable for all seasons.Styling & PairingA must-have for spring, summer, fall, and winter. Pair it with cargo pants, shorts, jeans, skirts, cardigans, hoodies, sweaters, and jackets for a fashion Y2K look. Enhance your wardrobe with this versatile piece.Care InstructionsMachine washable and dry-cleanable, ensuring easy maintenance. Keep your AUTOMET shirt looking its best with simple care instructions.",,32.99,Seldom Seen Styles,120726,,,https://images2.productserve.com/?w=200&h=200&bg=white&trim=5&t=letterbox&url=ssl%3Acdn.shopify.com%2Fs%2Ffiles%2F1%2F0885%2F0073%2F2222%2Ffiles%2F637bbea57b3342e5b03cae76ad35437b_tplv-fhlh96nyum-resize-jpeg_800_800.jpg%3Fv%3D1767086426&feedId=111395&k=2b72ae4f01cc28de9300365ae3415f33bac7aba4,USD,,,https://21c525-b8.myshopify.com/products/automet-womens-3-piece-long-sleeve-shirts-basic-crop-tops-going-out-fall-fashion-underscrubs-layer-slim-fit-y2k-tops-soft-fabric-crew-neck-casual-streetwear-haze-blue-white-black?variant=12221444915518,,,USD32.99,111395,Seldom Seen Styles,0,,,,,,Womens,Tops & T-Shirts
https://www.awin1.com/pclick.php?p=43786591312&a=2771700&m=120726,Striped Crop Top Knit Ribbed High Waist Bikini Set,43786591312,127190886,https://cdn.shopify.com/s/files/1/0885/0073/2222/files/55_3db1eacc-9b6f-4edb-8f62-281fa3726c6b.jpg?v=1761638900,"Details Elevate your summer wardrobe with our two-piece set! With different models to choose from, you can create amazing and stylish looks for any occasion. Made with high quality fabrics and following the latest trends, these swimsuits will ensure you feel comfortable and stylish at the same time. Whether it's the pool or the beach, you'll stand out in these amazing swimsuits. Get your 2-piece set now and be even more stylish in your summer season!-The latest fashion swimwear, a must-have for beach/hot spring/holiday.-Suitable for swimming or water sports.- with detachable chest pad Size Chart           ? US UK/AU EU   S 2-4 6-8 34-36   M 4-6 10-12 36-38   L 6-8 12-14 38-40   XL 8-10 16-18 40-42   2XL 12-14 18-20 42-44      ",,22,Seldom Seen Styles,120726,,,https://images2.productserve.com/?w=200&h=200&bg=white&trim=5&t=letterbox&url=ssl%3Acdn.shopify.com%2Fs%2Ffiles%2F1%2F0885%2F0073%2F2222%2Ffiles%2F55_3db1eacc-9b6f-4edb-8f62-281fa3726c6b.jpg%3Fv%3D1761638900&feedId=111395&k=456501641ba41e5c3963fac19cf270a223a9186d,USD,,,https://21c525-b8.myshopify.com/products/striped-crop-top-knit-ribbed-high-waist-bikini-set?variant=12143973302590,,,USD22.00,111395,Seldom Seen Styles,1,,,,,,Womens,Swimwear
https://www.awin1.com/pclick.php?p=43786592512&a=2771700&m=120726,Vintage Solid Long Sleeves Shirt & Top,43786592512,127198151,https://cdn.shopify.com/s/files/1/0885/0073/2222/files/f1b3ae823c60eaa9505fd8ad365b5c26_3a86a6f4-460b-4ef6-a1f1-109ce3167f86.jpg?v=1761643490,Product Details,,19.99,Seldom Seen Styles,120726,,,https://images2.productserve.com/?w=200&h=200&bg=white&trim=5&t=letterbox&url=ssl%3Acdn.shopify.com%2Fs%2Ffiles%2F1%2F0885%2F0073%2F2222%2Ffiles%2Ff1b3ae823c60eaa9505fd8ad365b5c26_3a86a6f4-460b-4ef6-a1f1-109ce3167f86.jpg%3Fv%3D1761643490&feedId=111395&k=2725d3663f2cc03d825eef6ff67793c89d71b78f,USD,,,https://21c525-b8.myshopify.com/products/jersey-loose-crew-neck-casual-sweatshirt-2?variant=12143998271806,,,USD19.99,111395,Seldom Seen Styles,1,,,,,,Womens,Tops & T-Shirts
https://www.awin1.com/pclick.php?p=43851661423&a=2771700&m=120726,Women's Smooth Satin Half-sleeved Top and Pant Suit Two-piece,43851661423,127201477,https://cdn.shopify.com/s/files/1/0885/0073/2222/files/jpg_759d9aa8-fa1f-4a7b-8e53-9bd0c6387dfa.jpg?v=1761709551,SPU: YSOYM2504   Style: Casual   Season: Summer   Neckline: Round Neck   Length: Short Sleeve   Fit Type: Loose   Material: Satin    Top size:            Size Chart： Length Sleeve Length Bust   CM inch CM inch CM inch   S 76 29.9  37 14.8  100 39.4    M 77 30.3  38 15.2  105 41.3    L 78 30.7  39 15.4  110 43.3    XL 79 31.1  40 15.7  115 45.3    2XL,,33.99,Seldom Seen Styles,120726,,,https://images2.productserve.com/?w=200&h=200&bg=white&trim=5&t=letterbox&url=ssl%3Acdn.shopify.com%2Fs%2Ffiles%2F1%2F0885%2F0073%2F2222%2Ffiles%2Fjpg_759d9aa8-fa1f-4a7b-8e53-9bd0c6387dfa.jpg%3Fv%3D1761709551&feedId=111395&k=9cabbe3db263bf46e44c47868edb784e056912eb,USD,,,https://21c525-b8.myshopify.com/products/womens-smooth-satin-half-sleeved-top-and-pant-suit-two-piece?variant=12144280043838,,,USD33.99,111395,Seldom Seen Styles,1,,,,,,Womens,Co-Ord
https://www.awin1.com/pclick.php?p=43786593781&a=2771700&m=120726,Fashion plain women's shirt tops casual pants,43786593781,127204282,https://cdn.shopify.com/s/files/1/0885/0073/2222/files/jpg_64f935fb-bce1-4189-9556-c676349481ad.jpg?v=1761709610,"SPU: YSYJ2404177,YSYJ2404243   Style: Casual   Pattern Type: Plain   Season: Spring/Summer   Length: Regular   Material: cotton    Top size:         Size Chart： Length Sleeve Length Bust   CM inch CM inch CM inch   S 60 23.6  48 19.2  103",,25.99,Seldom Seen Styles,120726,,,https://images2.productserve.com/?w=200&h=200&bg=white&trim=5&t=letterbox&url=ssl%3Acdn.shopify.com%2Fs%2Ffiles%2F1%2F0885%2F0073%2F2222%2Ffiles%2Fjpg_64f935fb-bce1-4189-9556-c676349481ad.jpg%3Fv%3D1761709610&feedId=111395&k=1420a0996695d02d9c23a001c6e86a590b6e2c73,USD,,,https://21c525-b8.myshopify.com/products/stylish-plain-womens-shirt-tops?variant=12144280797502,,,USD25.99,111395,Seldom Seen Styles,1,,,,,,Womens,Tops & T-Shirts
https://www.awin1.com/pclick.php?p=43851661603&a=2771700&m=120726,Pleated fabric top and pants suit,43851661603,127204450,https://cdn.shopify.com/s/files/1/0885/0073/2222/files/jpg_0e77df3a-897b-4d5c-b422-106aa8d93b22.jpg?v=1761709615,SPU:   YSCC2404151       Style:   Casual       Pattern Type:   Plain       Season:   Spring/Summer       Length:   Regular       Material:   Rayon                            Top Size   Length   Bust   Shoulder   Sleeve Length       CM   inch   CM   inch   CM   inch   CM   inch       S   70   27.6    95   37.4    42   16.5    60   23.6        M   71   28.0    100   39.4    43   16.9    61   24.0        L   72   28.3    105   41.3    44   17.3    62   24.4        XL   73   28.7    110   43.3    45   17.7    63   24.8        2XL   74   29.1    115   45.3    46   18.1    64   25.2        3XL   75   29.5    120   47.2    47   18.5    65   25.6        4XL   76   29.9    125   49.2    48   18.9    66   26.0        5XL   77   30.3    130   51.2    49   19.3    67   26.4                         Pants Size   Waist   Hips   Length       CM   inch   CM   inch   CM   inch       S   68   26.8    100   39.4    102,,35.99,Seldom Seen Styles,120726,,,https://images2.productserve.com/?w=200&h=200&bg=white&trim=5&t=letterbox&url=ssl%3Acdn.shopify.com%2Fs%2Ffiles%2F1%2F0885%2F0073%2F2222%2Ffiles%2Fjpg_0e77df3a-897b-4d5c-b422-106aa8d93b22.jpg%3Fv%3D1761709615&feedId=111395&k=e7a624f3fa7408cad8a7d8701f0a5b3e4bb61300,USD,,,https://21c525-b8.myshopify.com/products/pleated-fabric-top-and-pants-suit?variant=12144280895806,,,USD35.99,111395,Seldom Seen Styles,1,,,,,,Womens,Co-Ord
https://www.awin1.com/pclick.php?p=43851661972&a=2771700&m=120726,Women's Top Jacket & Elastic Pants Two-piece Set,43851661972,127207277,https://cdn.shopify.com/s/files/1/0885/0073/2222/files/jpg_d4099c60-2f07-42f9-84fa-5cb3511d7824.jpg?v=1761710169,"SPU:  YSOYM240829325    Style: Casual   Pattern Type: Plain   Season:  Spring, summer and autumn   Length: Regular   Material: Cotton   Top Size:          Size Chart：    Length   Bust   Sleeve Length       CM   inch   CM   inch   CM   inch       S   65   56.7    100   39.4    67   26.4        M   66   144   105   41.3    68   26.8        L   67   26.4    110   43.3    69   27.2        XL   68   26.8    115   45.3    70   27.6        2XL   69   27.2    120   47.2    71   28.0        3XL   70   27.6    125   49.2    72   28.3        4XL   71   28.0    130   51.2    73   28.7        5XL   72   28.3    135   53.1    74   29.1     Pants Size:           Size Chart： Length Hip Size Waist Size   CM inch CM inch CM inch   S 97 38.2  100 39.4  75 29.5    M 98",,35.99,Seldom Seen Styles,120726,,,https://images2.productserve.com/?w=200&h=200&bg=white&trim=5&t=letterbox&url=ssl%3Acdn.shopify.com%2Fs%2Ffiles%2F1%2F0885%2F0073%2F2222%2Ffiles%2Fjpg_d4099c60-2f07-42f9-84fa-5cb3511d7824.jpg%3Fv%3D1761710169&feedId=111395&k=ee75b4ca17bc17932514ddfc45f03099c6260b3c,USD,,,https://21c525-b8.myshopify.com/products/womens-top-jacket-elastic-pants-two-piece-set?variant=12144283681086,,,USD35.99,111395,Seldom Seen Styles,1,,,,,,Womens,Co-Ord
https://www.awin1.com/pclick.php?p=43851662182&a=2771700&m=120726,Women's Solid Color V-neck Top & Pants Two-piece Set,43851662182,127207543,https://cdn.shopify.com/s/files/1/0885/0073/2222/files/jpg_71550f8a-ca2a-4e9b-97b1-60d56eaf7d4e.jpg?v=1761710186,SPU: YSOYM240913144   Style: Casual   Pattern Type: Plain   Season: All season   Length: Regular   Material: Cotton     Top Size:              Top Size Length Bust Sleeve Length   CM inch CM inch CM inch   S 65 26 95 37 60 24   M 66 26,,41.99,Seldom Seen Styles,120726,,,https://images2.productserve.com/?w=200&h=200&bg=white&trim=5&t=letterbox&url=ssl%3Acdn.shopify.com%2Fs%2Ffiles%2F1%2F0885%2F0073%2F2222%2Ffiles%2Fjpg_71550f8a-ca2a-4e9b-97b1-60d56eaf7d4e.jpg%3Fv%3D1761710186&feedId=111395&k=0bfa9c301b30887a67ae1c30dd47c9bdc50fe0c3,USD,,,https://21c525-b8.myshopify.com/products/womens-solid-color-v-neck-top-pants-two-piece-set?variant=12144284008766,,,USD41.99,111395,Seldom Seen Styles,1,,,,,,Womens,Co-Ord
https://www.awin1.com/pclick.php?p=43794316844&a=2771700&m=120726,Casual Lapel Long Top and Trousers Two-piece Suit,43794316844,127209457,https://cdn.shopify.com/s/files/1/0885/0073/2222/files/jpg_e67f2da9-19d1-427a-a0bf-72685950fb94.jpg?v=1761710286,SPU:   YSHHP243534       Style:   casual       Color: apricot        Season:   spring/summer       Neckline: Lapel        Sleeve Length:   Midi sleeve       Material:   Cotton and linen        Size:   S/M/L/XL/2XL/3XL/4XL/5XL    shirt's size:             Size Chart：    Length   Sleeve Length   Bust       CM   inch   CM   inch   CM   inch       S   133   52.4    27   10.8    102   40.2        M   134   52.8    28   11.2    107   42.1        L   135   53.1    29   11.4    112   44.1        XL   136   53.5    30   11.8    117   46.1        2XL   137   53.9    31   12.2    122   48.0        3XL   138   54.3    32   12.6    127   50.0        4XL   139   54.7    33   13.0    132   52.0        5XL   140   55.1    34   13.4    137   53.9     Pants size:             Size Chart：    pants length   Hips   Waist       CM   inch   CM   inch   CM   inch       S   105   41.3    100   39.4    68   26.8        M   106   41.7    105   41.3    73   28.7        L   107,,38.99,Seldom Seen Styles,120726,,,https://images2.productserve.com/?w=200&h=200&bg=white&trim=5&t=letterbox&url=ssl%3Acdn.shopify.com%2Fs%2Ffiles%2F1%2F0885%2F0073%2F2222%2Ffiles%2Fjpg_e67f2da9-19d1-427a-a0bf-72685950fb94.jpg%3Fv%3D1761710286&feedId=111395&k=fdd89e6b10d4cc957b3abed52597d7bf5bed8bd2,USD,,,https://21c525-b8.myshopify.com/products/casual-lapel-long-top-and-trousers-two-piece-suit?variant=12144285516094,,,USD38.99,111395,Seldom Seen Styles,1,,,,,,Womens,Co-Ord
https://www.awin1.com/pclick.php?p=43851662487&a=2771700&m=120726,Women's Sexy Kink Long Sleeve Top And Pants Suit,43851662487,127209536,https://cdn.shopify.com/s/files/1/0885/0073/2222/files/jpg_b53bdd74-517a-4415-98ff-d1992f3339c7.jpg?v=1761710290,SPU: YSJX241217226   Style: Sexy   Pattern Type: Plain   Season: All seasons   Length: Routine   Material: Cotton Blend   Body Measurements:              Body Measurements  Size Chart： US UK EU Bust Waist Hips   CM inch,,34.99,Seldom Seen Styles,120726,,,https://images2.productserve.com/?w=200&h=200&bg=white&trim=5&t=letterbox&url=ssl%3Acdn.shopify.com%2Fs%2Ffiles%2F1%2F0885%2F0073%2F2222%2Ffiles%2Fjpg_b53bdd74-517a-4415-98ff-d1992f3339c7.jpg%3Fv%3D1761710290&feedId=111395&k=24b8983f4404b0c2a6f79c2d0e2f20780ab5ace7,USD,,,https://21c525-b8.myshopify.com/products/womens-sexy-kink-long-sleeve-top-and-pants-suit?variant=12144285581630,,,USD34.99,111395,Seldom Seen Styles,1,,,,,,Womens,Co-Ord
https://www.awin1.com/pclick.php?p=43851662838&a=2771700&m=120726,Women's stylish diamond-embellished top and pants two-piece set,43851662838,127210206,https://cdn.shopify.com/s/files/1/0885/0073/2222/files/jpg_c8e66327-1c2c-473b-97b0-6feec8c63031.jpg?v=1761710326,SPU: YSHLM241224332   Style: Fashion   Pattern Type: Plain   Season: Autumn and Winter   Length: Regular   Material: Cotton Blend,,39.99,Seldom Seen Styles,120726,,,https://images2.productserve.com/?w=200&h=200&bg=white&trim=5&t=letterbox&url=ssl%3Acdn.shopify.com%2Fs%2Ffiles%2F1%2F0885%2F0073%2F2222%2Ffiles%2Fjpg_c8e66327-1c2c-473b-97b0-6feec8c63031.jpg%3Fv%3D1761710326&feedId=111395&k=5093a6eba0122c842d36741709eed5a6660f2f40,USD,,,https://21c525-b8.myshopify.com/products/womens-stylish-diamond-embellished-top-and-pants-two-piece-set?variant=12144286105918,,,USD39.99,111395,Seldom Seen Styles,1,,,,,,Womens,Co-Ord
https://www.awin1.com/pclick.php?p=43851662669&a=2771700&m=120726,Women's fashion metallic fabric stand collar top and pants two-piece set,43851662669,127210657,https://cdn.shopify.com/s/files/1/0885/0073/2222/files/jpg_c74234c8-0856-476a-b204-7a6fd9fd282d.jpg?v=1761710341,SPU: YSHLM250106040   Style: Fashion   Pattern Type: Plain   Season: Autumn and Winter   Length: Regular   Material:,,41.99,Seldom Seen Styles,120726,,,https://images2.productserve.com/?w=200&h=200&bg=white&trim=5&t=letterbox&url=ssl%3Acdn.shopify.com%2Fs%2Ffiles%2F1%2F0885%2F0073%2F2222%2Ffiles%2Fjpg_c74234c8-0856-476a-b204-7a6fd9fd282d.jpg%3Fv%3D1761710341&feedId=111395&k=afce2a0157d2b4db57f4725152af965df9e65e2b,USD,,,https://21c525-b8.myshopify.com/products/womens-fashion-metallic-fabric-stand-collar-top-and-pants-two-piece-set?variant=12144286302526,,,USD41.99,111395,Seldom Seen Styles,1,,,,,,Womens,Co-Ord
https://www.awin1.com/pclick.php?p=43851662630&a=2771700&m=120726,Ladies' Lapel Printed Top+pants Loose Casual Suit,43851662630,127211867,https://cdn.shopify.com/s/files/1/0885/0073/2222/files/174841073741718200089.jpg?v=1761710410,SPU: XB880520    Style: Casual   Season:: Spring/Summer   Material: Blended   Size: XS/S/M/L/XL/2XL/3XL   Tops size:            Size Length Bust Sleeve Length   CM inch CM inch CM inch   XS 80,,41.99,Seldom Seen Styles,120726,,,https://images2.productserve.com/?w=200&h=200&bg=white&trim=5&t=letterbox&url=ssl%3Acdn.shopify.com%2Fs%2Ffiles%2F1%2F0885%2F0073%2F2222%2Ffiles%2F174841073741718200089.jpg%3Fv%3D1761710410&feedId=111395&k=81dca7b5053609b709b2e24ba89f65b5fd1ed0c5,USD,,,https://21c525-b8.myshopify.com/products/ladies-lapel-printed-top-pants-loose-casual-suit?variant=12144287220030,,,USD41.99,111395,Seldom Seen Styles,1,,,,,,Womens,Co-Ord
https://www.awin1.com/pclick.php?p=43851662911&a=2771700&m=120726,Ladies' Collar Hot Pressed Diamond Splicing Top+ Pants Casual Set,43851662911,127211958,https://cdn.shopify.com/s/files/1/0885/0073/2222/files/175246235292253500344.jpg?v=1761710439,SPU:  YB882224    Style: Casual   Season:: Spring/Summer   Material: Blended   Size: XS/S/M/L/XL/2XL/3XL   Tops Size:,,42.99,Seldom Seen Styles,120726,,,https://images2.productserve.com/?w=200&h=200&bg=white&trim=5&t=letterbox&url=ssl%3Acdn.shopify.com%2Fs%2Ffiles%2F1%2F0885%2F0073%2F2222%2Ffiles%2F175246235292253500344.jpg%3Fv%3D1761710439&feedId=111395&k=0757b615dc0b71a3504e5a87e0540cd051660cda,USD,,,https://21c525-b8.myshopify.com/products/ladies-collar-hot-pressed-diamond-splicing-top-pants-casual-set?variant=12144287351102,,,USD42.99,111395,Seldom Seen Styles,1,,,,,,Womens,Co-Ord
https://www.awin1.com/pclick.php?p=43851662882&a=2771700&m=120726,Women's V-neck Patchwork Printed Top and Pants Commuting Casual Suit,43851662882,127212694,https://cdn.shopify.com/s/files/1/0885/0073/2222/files/0c5ae88c-9689-4b05-a88a-824a21e36f78-0f0b10da-f474-4c27-8c7c-9278c75093cc.png?v=1761711979,SPU: YSHHP250303023   Style: Casual   Season: spring   Material: blended   Size: XS/S/M/L/XL/2XL/3XL       Tops size:              Size Length Bust Sleeve Length   CM inch CM inch CM inch   XS 124 48.8 90 35.4 56 22.0   S,,37.99,Seldom Seen Styles,120726,,,https://images2.productserve.com/?w=200&h=200&bg=white&trim=5&t=letterbox&url=ssl%3Acdn.shopify.com%2Fs%2Ffiles%2F1%2F0885%2F0073%2F2222%2Ffiles%2F0c5ae88c-9689-4b05-a88a-824a21e36f78-0f0b10da-f474-4c27-8c7c-9278c75093cc.png%3Fv%3D1761711979&feedId=111395&k=e6ba6607fafa917b423cd672c678fe8f7546ec61,USD,,,https://21c525-b8.myshopify.com/products/womens-v-neck-patchwork-printed-top-and-pants-commuting-casual-suit?variant=12144289775934,,,USD37.99,111395,Seldom Seen Styles,1,,,,,,Womens,Co-Ord
