aw_deep_link,product_name,aw_product_id,merchant_product_id,merchant_image_url,description,merchant_category,search_price,merchant_name,merchant_id,category_name,category_id,aw_image_url,currency,store_price,delivery_cost,merchant_deep_link,language,last_updated,display_price,data_feed_id,brand_name,in_stock,large_image,alternate_image,alternate_image_two,alternate_image_four,alternate_image_three,gender_added,category_added
https://www.awin1.com/pclick.php?p=44244507578&a=2771700&m=120726,"Women's Solid Drawstring Full Zip Up Hooded Spring Crochet Cardigan, Back To School Outfits, Drop Shoulder Kitting Fall Sweater Tops, Cardigan for Women, Casual Solid Dual Pocket Fall Outerwear for New Style, Fall outfits, Fallfreshness",44244507578,130587558,https://cdn.shopify.com/s/files/1/0885/0073/2222/files/a8aea46b-43c7-4e7f-b157-f084437aa5de.jpg?v=1760168747,"  This women's solid crochet cardigan features a full zip closure with a drawstring hood, offering adjustable comfort ideal for spring and fall layering. Designed with drop shoulder knitting and dual pockets, it combines casual style with functionality, perfect for back-to-school outfits and everyday wear. The lightweight yet cozy fabric provides warmth during cooler days without bulk, making it a versatile addition to your seasonal wardrobe.",,24.52,Seldom Seen Styles,120726,,,https://images2.productserve.com/?w=200&h=200&bg=white&trim=5&t=letterbox&url=ssl%3Acdn.shopify.com%2Fs%2Ffiles%2F1%2F0885%2F0073%2F2222%2Ffiles%2Fa8aea46b-43c7-4e7f-b157-f084437aa5de.jpg%3Fv%3D1760168747&feedId=111395&k=8c8c6fe76f03197330a63f906782e3e53230ae2f,USD,,,https://21c525-b8.myshopify.com/products/womens-solid-drawstring-full-zip-up-hooded-spring-crochet-cardigan-back-to-school-outfits-drop-shoulder-kitting-fall-sweater-tops-cardigan-for-women-casual-solid-dual-pocket-fall-outerwear-for-new-style-fall-outfits-fallfreshness?variant=12060594602302,,,USD24.52,111395,Seldom Seen Styles,1,,,,,,Womens,Jumpers & Knits
https://www.awin1.com/pclick.php?p=44255467989&a=2771700&m=120726,Women's Oversized Sweatshirts Casual Long Sleeve Button Henley Collar Purple Pullover Tunic Tops 2025 Womenswear Fall Winter Outfits,44255467989,130587693,https://cdn.shopify.com/s/files/1/0885/0073/2222/files/808a998c-5313-4364-b07f-a372fc9237a5.jpg?v=1760168843,"This oversized women's sweatshirt features a relaxed fit with a buttoned Henley collar, combining comfort with a modern casual style. Crafted for fall and winter wear, its long sleeves and soft fabric provide warmth while the vibrant purple hue adds a bold touch to any outfit. Perfect for layering or wearing alone, this pullover tunic offers versatility for seasonal wardrobe essentials.     ",,26.48,Seldom Seen Styles,120726,,,https://images2.productserve.com/?w=200&h=200&bg=white&trim=5&t=letterbox&url=ssl%3Acdn.shopify.com%2Fs%2Ffiles%2F1%2F0885%2F0073%2F2222%2Ffiles%2F808a998c-5313-4364-b07f-a372fc9237a5.jpg%3Fv%3D1760168843&feedId=111395&k=ba80826e458ceb2f43b61aac1408d6db5dc3022d,USD,,,https://21c525-b8.myshopify.com/products/womens-oversized-sweatshirts-casual-long-sleeve-button-henley-collar-purple-pullover-tunic-tops-2025-womenswear-fall-winter-outfits?variant=12060598337854,,,USD26.48,111395,Seldom Seen Styles,1,,,,,,Womens,Jumpers & Knits
https://www.awin1.com/pclick.php?p=44244499344&a=2771700&m=120726,Women's Casual 2-Piece Lounge Set Soft Chunky V Neck Tops Wide Leg Long Pants Basic Tracksuit Lounge Wear Minimalist Womenswear,44244499344,130587738,https://cdn.shopify.com/s/files/1/0885/0073/2222/files/3266b78b-decc-4119-9d19-de9318053b4d.jpg?v=1760168900,"This Women's Casual 2-Piece Lounge Set offers a harmonious blend of comfort and modern style. Featuring a soft, chunky V-neck top paired with wide-leg long pants, it provides relaxed yet refined wearability. The minimalist design ensures versatility, making it ideal for lounging or casual outings. Crafted from breathable fabrics, this basic tracksuit prioritizes ease of movement and lasting comfort, delivering a sophisticated essential for any laid-back wardrobe.",,28.16,Seldom Seen Styles,120726,,,https://images2.productserve.com/?w=200&h=200&bg=white&trim=5&t=letterbox&url=ssl%3Acdn.shopify.com%2Fs%2Ffiles%2F1%2F0885%2F0073%2F2222%2Ffiles%2F3266b78b-decc-4119-9d19-de9318053b4d.jpg%3Fv%3D1760168900&feedId=111395&k=736b11b9c041b26a1da0ec8ef1ab70ed3d9066f3,USD,,,https://21c525-b8.myshopify.com/products/womens-casual-2-piece-lounge-set-soft-chunky-v-neck-tops-wide-leg-long-pants-basic-tracksuit-lounge-wear-minimalist-womenswear?variant=12060600566078,,,USD28.16,111395,Seldom Seen Styles,1,,,,,,Womens,Co-Ord
https://www.awin1.com/pclick.php?p=44244507188&a=2771700&m=120726,Oversized Knit Top Short Sleeve Sweater | Women's Clothing,44244507188,130587768,https://cdn.shopify.com/s/files/1/0885/0073/2222/files/apricot-pullover-sweater.jpg?v=1760235714,"This oversized knit top combines relaxed comfort with stylish simplicity. Crafted with breathable fabric and a short sleeve design, it offers easy layering and year-round versatility. Its loose fit ensures comfort and flattering movement, making it a sophisticated staple for any modern wardrobe. Perfect for pairing with jeans or skirts, it delivers effortless chic with expert-crafted softness and quality.",,35,Seldom Seen Styles,120726,,,https://images2.productserve.com/?w=200&h=200&bg=white&trim=5&t=letterbox&url=ssl%3Acdn.shopify.com%2Fs%2Ffiles%2F1%2F0885%2F0073%2F2222%2Ffiles%2Fapricot-pullover-sweater.jpg%3Fv%3D1760235714&feedId=111395&k=3d20687dde875f2a4afa5272db7000a713ce73e9,USD,,,https://21c525-b8.myshopify.com/products/oversized-knit-top-short-sleeve-sweater-womens-clothing?variant=12060902097214,,,USD35.00,111395,Seldom Seen Styles,1,,,,,,Womens,Jumpers & Knits
https://www.awin1.com/pclick.php?p=44244501678&a=2771700&m=120726,⏳Time-limited Special⏰Women's Crew Neck Top & Drawstring Pants Set,44244501678,130587859,https://cdn.shopify.com/s/files/1/0885/0073/2222/files/spp_shopify20250926123136_c3ff56cee5b201ba9c70aa5b62391623_8cc88b8f-9ba6-432c-b61e-20627b3e2750.jpg?v=1760235730,"SIZE GUIDE   FEATURES COMFORTABLE CREW NECK TOP – This women's crew neck top features a relaxed and comfortable design, perfect for all-day wear. The soft fabric gently hugs your body without feeling tight, ensuring comfort whether you're lounging at home or out with friends.  ADJUSTABLE DRAWSTRING PANTS – The matching drawstring pants are designed with an elastic waistband for a flexible fit. You can adjust the waistband to your desired comfort level, providing a secure and comfortable fit. These pants offer both comfort and style, with a streamlined look that makes them suitable for both casual and semi-casual occasions.  SOFT AND BREATHABLE FABRIC – Crafted from high-quality, elastic fabric, this top and pants set is soft to the touch and breathable. Whether it's warm or cool outside, the fabric ensures you stay comfortable throughout the day. The fibers allow air circulation, reducing the risk of discomfort or overheating, making it the ideal choice for year-round wear.  VERSATILE STYLING OPTIONS – Designed to be versatile, this coordinated set allows you to mix and match with other wardrobe pieces. The neutral colors ensure compatibility with a wide range of accessories, shoes, and outerwear. Wear it as a coordinated set or pair each piece with other favorites for endless outfit possibilities.  EASY CARE AND MAINTENANCE – Maintaining this top and pants set is a breeze. The fabric is resistant to fading and maintains its vibrant color even after multiple washes. You can easily machine wash it, making it perfect for busy individuals who need a low-maintenance wardrobe staple.  SPECIFICATION Color:Beige, Black, Gray-Purple, Dark Green, Dark Gray Size:S, M, L, XL, 2XL, 3XL Material:Polyester, Spandex Package Includes:1 * Women's Crew Neck Top & Drawstring Pants Set NOTES Please allow 2-3cm error due to manual measurement. Please make sure you do not mind before purchasing. Color may not appear as exactly as in real life due to variations between the computer monitors.",,39.99,Seldom Seen Styles,120726,,,https://images2.productserve.com/?w=200&h=200&bg=white&trim=5&t=letterbox&url=ssl%3Acdn.shopify.com%2Fs%2Ffiles%2F1%2F0885%2F0073%2F2222%2Ffiles%2Fspp_shopify20250926123136_c3ff56cee5b201ba9c70aa5b62391623_8cc88b8f-9ba6-432c-b61e-20627b3e2750.jpg%3Fv%3D1760235730&feedId=111395&k=ed3b8df7a14aca923fcb8478bc61267efb7438b1,USD,,,https://21c525-b8.myshopify.com/products/set05?variant=12060902326590,,,USD39.99,111395,Seldom Seen Styles,1,,,,,,Womens,Co-Ord
https://www.awin1.com/pclick.php?p=44244510766&a=2771700&m=120726,?Last day offer: 50% off-Elegant Longline Cardigan & Top & Pants 3-Pieces Set,44244510766,130587889,https://cdn.shopify.com/s/files/1/0885/0073/2222/files/spp_shopify20250925091841_4be5b8229a1397551db4241589056bf3_2841d8cb-cda5-45d7-812c-89573f695653.jpg?v=1760235739,"?Three-Piece Style, Endless Possibilities! Redefine effortless elegance with this versatile set. Soft, breathable fabric for comfort all day?  SIZE GUIDE  FEATURES TIMELESS MINIMALIST AESTHETIC - Clean lines and refined cuts create a look that’s always in style. Designed to transcend seasons, this set embodies quiet sophistication—a tribute to enduring elegance and modern simplicity.  INCLUSIVE, RELAXED FIT - Designed to flatter every silhouette, our relaxed fit celebrates freedom and confidence. The elasticated waist ensures gentle support and effortless comfort, moving with you throughout your day while enhancing your natural shape.  SUPERIOR COMFORT - Draped in feather-soft fabric that feels like a second skin, this ensemble offers all-day ease without compromising elegance. Lightweight and fluid, it moves with you—keeping you effortlessly comfortable from morning to moonlight.  EFFORTLESS ELEGANCE FOR EVERY OCCASION - Move through your day with grace and style. This set transitions effortlessly from work to weekend, offering endless combinations to express your personal aesthetic. It’s more than clothing—it’s your versatile companion for a life in motion.  SPEC Color: Brown, Navy Size: S, M, L, XL, 2XL, 3XL, 4XL, 5XL Main Fabric: Polyester Top Sleeve Length: Short Sleeve Package Includes:  1×Short Sleeve Top 1×Loose Long Pants 1×Open-Front Longline Cardigan NOTES",,43,Seldom Seen Styles,120726,,,https://images2.productserve.com/?w=200&h=200&bg=white&trim=5&t=letterbox&url=ssl%3Acdn.shopify.com%2Fs%2Ffiles%2F1%2F0885%2F0073%2F2222%2Ffiles%2Fspp_shopify20250925091841_4be5b8229a1397551db4241589056bf3_2841d8cb-cda5-45d7-812c-89573f695653.jpg%3Fv%3D1760235739&feedId=111395&k=f92040380368fc9592a2d37fe31f241cc3d406ea,USD,,,https://21c525-b8.myshopify.com/products/elegant-longline-ca?variant=12060902359358,,,USD43.00,111395,Seldom Seen Styles,1,,,,,,Womens,Co-Ord
https://www.awin1.com/pclick.php?p=44255472392&a=2771700&m=120726,Women's Winter Oversized Puffer Vest Lightweight Stand Collar Flysleeve Insulated Padded Puffy Jackets Coat with Pockets Outerwear Casual Zipper Tops Black Fitted Minimalist,44255472392,130588047,https://cdn.shopify.com/s/files/1/0885/0073/2222/files/ef4309a4-b374-4b7b-9b61-ebf6296d370a.jpg?v=1760248906,"Features: Oversized puffer vest for women featured in sleevless, full zip, stand collar, drop sholder, two side hand pockets, adjustable drawstring hem, lightweight qulited padded puffer vests, keeping you warm during chilly commutes.Pair With - Puffer vest for women fits nicely over a long sleeve shirt/thick sweater/hoodie/dresses for a casual look, keep you comfy and warm.Vest jacket is always a trendy style as easy to match with all your outfitsWomen sleeveless outerwear puffer vest is perfect for many occasions like hiking, biking, climbing, school, work, shopping, enjoy the warm without being bloated  Fashion lightweight warm padded gilet, perfect for fall, winter and early spring. Basic and versatile puffer vest that will give you a comfy and trendy fit",,28.44,Seldom Seen Styles,120726,,,https://images2.productserve.com/?w=200&h=200&bg=white&trim=5&t=letterbox&url=ssl%3Acdn.shopify.com%2Fs%2Ffiles%2F1%2F0885%2F0073%2F2222%2Ffiles%2Fef4309a4-b374-4b7b-9b61-ebf6296d370a.jpg%3Fv%3D1760248906&feedId=111395&k=f4475ac0ad6b2f07468554558628a522f0f95ce5,USD,,,https://21c525-b8.myshopify.com/products/tanming-womens-winter-oversized-puffer-vest-lightweight-stand-collar-flysleeve-insulated-padded-puffy-jackets-coat-with-pockets-outerwear-casual-zipper-tops-black-fitted-minimalist-fallfreshness?variant=12060916318526,,,USD28.44,111395,Seldom Seen Styles,1,,,,,,Womens,Coats & Jackets
https://www.awin1.com/pclick.php?p=44244507234&a=2771700&m=120726,"Women's Solid Color Off Shoulder Minimalist Sweater for Spring & Fall, Mean Girls Casual Chic Flattering Fit Long Sleeve Jumper, Women's Tops, Women's Sweaters Knitwear for Autumn Daily Wear, Women's Fall Clothing, Going Out Tops",44244507234,130588137,https://cdn.shopify.com/s/files/1/0885/0073/2222/files/58b1b8b3-fe24-49d1-a625-a1432d217efa.jpg?v=1760249077,"  【Off the Shoulder Design】: Shows your charm and fashion sense. 【Versatile Styling】: Transition effortlessly from a casual day out to an evening gathering with the women's solid color off shoulder minimalist sweater.Pair it with skinny jeans for a laid-back look or a pencil skirt for a touch of elegance, perfect for embracing the Y2K trend with ease. 【Seasonal Comfort】: Designed for the transitional weather of spring & fall, this long sleeve jumper provides cozy warmth without compromising on style, making it a staple for cooler days. 【Easy Care】: Keep your sweater looking its best with simple care instructions—either dry clean or hand wash only to maintain its quality and longevity. 【Flattering Fit】: Enjoy a fitted silhouette that accentuates your figure, crafted with slight stretch for comfort and a perfect fit, available in sizes S to XXL.",,23.54,Seldom Seen Styles,120726,,,https://images2.productserve.com/?w=200&h=200&bg=white&trim=5&t=letterbox&url=ssl%3Acdn.shopify.com%2Fs%2Ffiles%2F1%2F0885%2F0073%2F2222%2Ffiles%2F58b1b8b3-fe24-49d1-a625-a1432d217efa.jpg%3Fv%3D1760249077&feedId=111395&k=3bc22d05052ed12efe56449cee88e1e3207eb11d,USD,,,https://21c525-b8.myshopify.com/products/womens-solid-color-off-shoulder-minimalist-sweater-for-spring-fall-mean-girls-casual-chic-flattering-fit-long-sleeve-jumper-womens-tops-womens-sweaters-knitwear-for-autumn-daily-wear-womens-fall-clothing-going-out-tops?variant=12060916547902,,,USD23.54,111395,Seldom Seen Styles,1,,,,,,Womens,Jumpers & Knits
https://www.awin1.com/pclick.php?p=44244501674&a=2771700&m=120726,Songling Women Casual Two Piece Outfits 3/4 Batwing Sleeve Capelet CrewNeck Pullover Top Wide Leg Pants Lounge Sets Sweatsuit,44244501674,130588286,https://cdn.shopify.com/s/files/1/0885/0073/2222/files/58366afc-6e36-4029-b15b-30babbe2667f.jpg?v=1760317037,"Top Features: Solid color design, flowing batwing sleeves, round neckline, raw edge detailing, dropped shoulders.Casual Pants: These high-waisted pants feature an elastic waistband and two side pockets for keys, a phone, or lipstick.They can be paired with the top to create a matching two-piece ensemble.  The women's two-piece set can be worn separately or paired with other garments, making it a versatile choice for any occasion.For example,the 3/4 ruffled sleeve pullover top can be paired with jeans, leggings, or shorts.Pants are an ideal choice to pair with any type of top.  These two-piece activewear sets are suitable for various activities, including beach trips, shopping, and everyday wear. They are also perfect for hiking and year-round beach wear, making them an ideal addition to any wardrobe. This Malibu travel set is also perfect for birthdays, Thanksgiving, and Christmas.  Turn this womens pyjamas sets inside out, machine wash on cold, and tumble dry on low.  US SIZE. If you have any questions about our matching sets, please contact us by e-mail or Q&A.",,28.44,Seldom Seen Styles,120726,,,https://images2.productserve.com/?w=200&h=200&bg=white&trim=5&t=letterbox&url=ssl%3Acdn.shopify.com%2Fs%2Ffiles%2F1%2F0885%2F0073%2F2222%2Ffiles%2F58366afc-6e36-4029-b15b-30babbe2667f.jpg%3Fv%3D1760317037&feedId=111395&k=44afb599deaf4e4accf5452e1ca56127535c5749,USD,,,https://21c525-b8.myshopify.com/products/fallfreshness-songling-women-casual-two-piece-outfits-3-4-batwing-sleeve-capelet-crewneck-pullover-top-wide-leg-pants-lounge-sets-sweatsuit?variant=12061070262590,,,USD28.44,111395,Seldom Seen Styles,1,,,,,,Womens,Co-Ord
https://www.awin1.com/pclick.php?p=44244507338&a=2771700&m=120726,Sweaters for Women Fashion Solid Crewneck Loose Fit Long Sleeve Contrast Cable Knit Pullover Sweater Jumper Tops Knitwear Womenswear Knitwear Womenswear,44244507338,130588351,https://cdn.shopify.com/s/files/1/0885/0073/2222/files/513fc98f-d161-4be4-8bfa-c3457784e9d5.jpg?v=1760317066,"Fabric type: 65%Acrylic+35%PolyamideDokotoo fashion pullover sweaters is made with high-quality and skin-friendly fabric. It offers a soft, lightweight, and comfortable wearing experience. Create an effortless casual look and keep you pleasant all the timeFeature: crewneck, solid color, long sleeve, wide sleeve, contrast stitch design, pullover sweaters, cable knit, ribbed Knit, loose fit sweaterMatch: this stylish solid pullover sweaters features full long sleeves, keep you warm in chilly days.It's very suitable for fall and winter wear.This cozy and soft pullover sweaters which can be worn alone, as well as pair perfectly with variety of coats, puffer jacket, shacket jacket, jeans, denim shorts, skirts, handbags, sneakers or heels to complete a simple and fashionable lookOccasion: the casual loose sweaters jumper tops is perfect choice for your daily wear, outdoor activities, shopping, dates, vacation and any other occasions in Spring, Fall and WinterPackage content: 1 X womens sweaters",,28.16,Seldom Seen Styles,120726,,,https://images2.productserve.com/?w=200&h=200&bg=white&trim=5&t=letterbox&url=ssl%3Acdn.shopify.com%2Fs%2Ffiles%2F1%2F0885%2F0073%2F2222%2Ffiles%2F513fc98f-d161-4be4-8bfa-c3457784e9d5.jpg%3Fv%3D1760317066&feedId=111395&k=536f105ef67002bfb689c1d7b3e5188d82bd9efb,USD,,,https://21c525-b8.myshopify.com/products/sweaters-for-women-fashion-solid-crewneck-loose-fit-long-sleeve-contrast-cable-knit-pullover-sweater-jumper-tops-knitwear-womenswear-knitwear-womenswear?variant=12061070328126,,,USD28.16,111395,Seldom Seen Styles,1,,,,,,Womens,Jumpers & Knits
https://www.awin1.com/pclick.php?p=44244497384&a=2771700&m=120726,"Women's Solid Sweater & Pants Set, Casual Fashion Cozy Top & Trousers for Fall, 2 Piece Sets Women, Women's Fall Knitwear Outfits, Sweater Sets, Sweater Co-ords",44244497384,130588429,https://cdn.shopify.com/s/files/1/0885/0073/2222/files/1fdd7eb2-5535-4ffe-b8c1-a99c10441ed7.jpg?v=1760317178,"【Unique Off-Shoulder】: Features a distinctive off-shoulder style that adds a touch of allure to the classic long sleeve look.【Textured Knit】: Crafted from thick sweater fabric with a charming twist, providing both warmth and an interesting visual appeal.【Fitted Silhouette】: Designed with a fitted cut that flatters the body shape while remaining comfortable for everyday wear.【Seasonal Versatility】: Specifically made for fall and winter, ensuring cozy wear during the colder months with appropriate thickness.【Regular Length】: Practical regular length that offers ease of movement and suitability for various body types.",,28.44,Seldom Seen Styles,120726,,,https://images2.productserve.com/?w=200&h=200&bg=white&trim=5&t=letterbox&url=ssl%3Acdn.shopify.com%2Fs%2Ffiles%2F1%2F0885%2F0073%2F2222%2Ffiles%2F1fdd7eb2-5535-4ffe-b8c1-a99c10441ed7.jpg%3Fv%3D1760317178&feedId=111395&k=a392bcb8fe524d918e09e4ffc650a606051ed0de,USD,,,https://21c525-b8.myshopify.com/products/womens-solid-sweater-pants-set-casual-fashion-cozy-top-trousers-for-fall-2-piece-sets-women-womens-fall-knitwear-outfits-sweater-sets-sweater-co-ords?variant=12061070426430,,,USD28.44,111395,Seldom Seen Styles,1,,,,,,Womens,Co-Ord
https://www.awin1.com/pclick.php?p=44244507077&a=2771700&m=120726,2025 FW ChicMe Women's 2 Piece Lounge Outfit Long Sleeve Pullover Tops Drawstring High Waisted Pants Set Tracksuit Round Neck Pre-Fall Sweatpants Sets,44244507077,130588673,https://cdn.shopify.com/s/files/1/0885/0073/2222/files/76a1fd3a-7211-45ee-9e48-3558fc980cb3.jpg?v=1760329601,"2025 FW ChicMe Women's 2 Piece Lounge Outfit Long Sleeve Pullover Tops Drawstring High Waisted Pants Set Tracksuit Round Neck Pre-Fall Sweatpants SetsAbout this ItemSoft, Cozy Fabric: Made from soft and breathable fabric, this tracksuit ensures maximum comfort throughout the day.Comfortable Pullover Top: The long sleeve pullover top offers a relaxed fit, perfect for lounging or casual outings.Adjustable Drawstring Waist: The high-waisted pants feature a drawstring for a customizable fit, providing both style and comfort.Versatile for Casual Wear: This lounge set is ideal for casual wear, whether you're relaxing at home, running errands, or enjoying a laid-back day out.Product DetailsStyle: Casual,SportyType: Pants Sets,Sweatpants SetsMaterial: 43% Viscose,32% Polyamides, 25% PolyesterPackage Include: 2PCS/Set 1*Top & PantsSize Guide (Body Measurements for Reference)",,29.99,Seldom Seen Styles,120726,,,https://images2.productserve.com/?w=200&h=200&bg=white&trim=5&t=letterbox&url=ssl%3Acdn.shopify.com%2Fs%2Ffiles%2F1%2F0885%2F0073%2F2222%2Ffiles%2F76a1fd3a-7211-45ee-9e48-3558fc980cb3.jpg%3Fv%3D1760329601&feedId=111395&k=c74a113e0767be2bcb32a6433970d8448b764ff7,USD,,,https://21c525-b8.myshopify.com/products/2025-fw-chicme-womens-2-piece-lounge-outfit-long-sleeve-pullover-tops-drawstring-high-waisted-pants-set-tracksuit-round-neck-pre-fall-sweatpants-sets?variant=12061091004734,,,USD29.99,111395,Seldom Seen Styles,1,,,,,,Womens,Co-Ord
https://www.awin1.com/pclick.php?p=44255472075&a=2771700&m=120726,Jacket for Women Casual Fall Hooded Puffer Long Sleeve Button Oversized Lightweight Basic Winter Black Outerwear Comfort Coat Tops 2025 Womenswear Outfits,44255472075,130588764,https://cdn.shopify.com/s/files/1/0885/0073/2222/files/76298c11-005a-4df9-b3fe-8eec592acb44.jpg?v=1760329747,"Lightweight, not a padded jacket.   Overall length of jacket, sleeves are on the short side               Cozy Material: This quilted jackets for women are made of 100%polyester.It's soft and comfy to wear.the lightweight fabric keeps you warm and comfortable in the fall and winter.   Women's fashion 2025: The lightweight quilted jackets for women are designed with a chic diamond texture, long sleeves, button-down, hooded, side pockets, and a loose boyfriend-style coat.This casual outerwear is suitable for cold weather and should be the top pick for your perfect wardrobe.   Pair tips: This women's down jacket is especially suitable for daily wear.It perfectly matches with leggings, skinny jeans, casual pants, sports shoes or thigh boots.It constitutes a simple and stylish clothing that can meet your daily fashion needs, which is exquisite and casual.   Occasions: Women's fashion jacket are perfect for daily wear, office, vacation, going out, beach, dating, travel, holiday, home, outdoor, street, etc.   Suggestion: Please check measurements before ordering. Kindly pay attention that different colors have different sizes. Machine/Hand wash cold, line dry.",,45,Seldom Seen Styles,120726,,,https://images2.productserve.com/?w=200&h=200&bg=white&trim=5&t=letterbox&url=ssl%3Acdn.shopify.com%2Fs%2Ffiles%2F1%2F0885%2F0073%2F2222%2Ffiles%2F76298c11-005a-4df9-b3fe-8eec592acb44.jpg%3Fv%3D1760329747&feedId=111395&k=ff812251f9061a881931128d3381fdaf79cb077f,USD,,,https://21c525-b8.myshopify.com/products/evaless-puffer-jacket-for-women-lightweight-long-sleeve-button-hoodies-outerwear-oversized-basic-casual-comfort-coats-tops-2025-womenswear-fall-winter-outfits?variant=12061091168574,,,USD45.00,111395,Seldom Seen Styles,1,,,,,,Womens,Coats & Jackets
https://www.awin1.com/pclick.php?p=44244509317&a=2771700&m=120726,"Women's Knit Pullover Sweater Tops - Casual Long Sleeve Button Down Crew Neck Ruffle Solid Color Striped - Knitwear, Womenswear",44244509317,130588936,https://cdn.shopify.com/s/files/1/0885/0073/2222/files/fced8fcc-b41b-4626-ab8a-714982c8615e.jpg?v=1760330020,"Stay cozy and chic with BTFBM Women's Knit Pullover Sweater Tops.Perfect for adding a touch of style to your wardrobe, these sweaters offer a comfortable fit and quality craftsmanship.Fabric Type: 50% Acrylic, 30% Polyamide, 20% PolyesterSize Attention: S=US 4-6, M=US 8-10, L=US 12-14, XL=US 16Soft Fine Knit: Made from super soft fine knit material, these sweaters are gentle on your skin and provide all-day comfort.Tailored Fit: The perfect tailored fit of these tops enhances your appearance while ensuring a flattering silhouette.Casual Style: Featuring a button-down crew neck and ruffle detailing, these sweaters effortlessly blend casual charm with feminine elegance.",,28.18,Seldom Seen Styles,120726,,,https://images2.productserve.com/?w=200&h=200&bg=white&trim=5&t=letterbox&url=ssl%3Acdn.shopify.com%2Fs%2Ffiles%2F1%2F0885%2F0073%2F2222%2Ffiles%2Ffced8fcc-b41b-4626-ab8a-714982c8615e.jpg%3Fv%3D1760330020&feedId=111395&k=7435d946b3fa606aec5b0bf9f9eb4d6b3ef56ec1,USD,,,https://21c525-b8.myshopify.com/products/btfbm-womens-knit-pullover-sweater-tops-casual-long-sleeve-button-down-crew-neck-ruffle-solid-color-striped-knitwear-womenswear?variant=12061091496254,,,USD28.18,111395,Seldom Seen Styles,1,,,,,,Womens,Jumpers & Knits
